identifier,labels,en,es-CO,de,fr-CA,nl,context
general-rotate-device,general,Please rotate your device for the best view of the activities.,Por favor utiliza la tableta en modo horizontal para que las actividades se puedan visualizar correctamente.,"Bitte drehen Sie Ihr Gerät, damit Sie die Aktivitäten optimal sehen können.",Please rotate your device for the best view of the activities.,Please rotate your device for the best view of the activities.,
general-device-type,general,"Please use a tablet in landscape mode, or a desktop computer or a laptop to complete the activities.","Por favor utiliza una tableta en modo horizontal, un ordenador de sobremesa o un portátil para que las actividades se puedan visualizar correctamente.","Bitte verwenden Sie ein Tablet im Querformat, einen Desktop-Computer oder einen Laptop, um die Aufgaben zu lösen.","Please use a tablet in landscape mode, a desktop computer, or a laptop to complete the activities.","Please use a tablet in landscape mode, a desktop computer, or a laptop to complete the activities.",
general-intro1,general,Hi! We are excited to have you play some games with us today!,¡Hola! ¡Estamos encantados de que juegues hoy con nosotros!,"Hallo! Wir freuen uns, dass du heute ein paar Spiele mit uns spielst!",Salut ! Nous sommes ravis que tu joues à des jeux avec nous aujourd'hui !,Hoi! We zijn blij dat je vandaag een paar spelletjes met ons wilt spelen!,
general-intro2,general,"First, you get to choose a buddy to play along with you. As you complete the different games, you will get to pick an accessory like a hat or glasses to decorate your buddy.","En primer lugar, tienes que elegir a un amigo para que juegue contigo. A medida que completes los diferentes juegos, podrás elegir un accesorio como un sombrero o unas gafas para decorar a tu amigo.","Zuerst kannst du einen Spielpartner auswählen, der die Spiele zusammen mit dir spielt. Nach jedem Spiel darfst du dir eine Sache aussuchen, zum Beispiel einen Hut oder eine Brille, die dein Spielpartner dann aufsetzen oder anziehen kann.","Tout d'abord, vous devez choisir un partenaire pour jouer avec vous. Au fil des jeux, vous pourrez choisir un accessoire, comme un chapeau ou des lunettes, pour décorer votre partenaire.","Eerst mag je een buddy kiezen om mee te spelen. Naarmate je de verschillende spellen voltooit, mag je een accessoire kiezen, zoals een hoed of een bril, om je buddy te versieren.",
pick-buddy,general,Pick a buddy to play with!,¡Escoge un amigo para jugar!,"Du kannst dir jetzt aussuchen, wer mit dir spielen soll!",Choisissez un ami avec qui jouer !,Pick a buddy to play with!,
general-intro3,general,"Now that you have your buddy, we want to explain how the games work.","Ahora que ya tienes a tu amigo, queremos explicarte cómo funcionan los juegos.","Super, jetzt hast du deinen Spielpartner! Jetzt wollen wir dir erklären, wie die Spiele funktionieren.","Maintenant que tu as ton copain, nous voulons t'expliquer comment fonctionnent les jeux.","Nu je je buddy hebt, willen we uitleggen hoe de spellen werken.",
general-intro4,general,"During the games you will need to listen to instructions so make sure your speakers are on and the volume is the way you like it. If you need to hear the instructions again, you can click the speaker button up in the corner of your screen.","Durante los juegos tendrás que escuchar las instrucciones, así que asegúrate de que los altavoces están encendidos y el volumen está a tu gusto. Si necesitas volver a escuchar las instrucciones, presiona el botón del altavoz situado en la esquina superior de la pantalla.","Während der Spiele wirst du Anweisungen hören. Achte also darauf, dass deine Lautsprecher eingeschaltet sind und die Lautstärke für dich angenehm ist. Wenn du die Anweisungen noch einmal hören möchtest, kannst du auf die Lautsprechertaste oben in der Ecke deines Bildschirms klicken.","Pendant les jeux, tu devras écouter les instructions, alors assure-toi que les haut-parleurs sont activés et que le volume te convient. Si tu souhaites réécouter les instructions, tu peux cliquer sur le bouton haut-parleur dans le coin de ton écran.","Tijdens de games moet je naar de instructies luisteren, dus zorg ervoor dat je speakers aanstaan en dat het volume naar wens is. Als je de instructies nog een keer wilt horen, kun je op de speakerknop in de hoek van je scherm klikken.",
general-intro5,general,"You can choose your answers in different ways depending on the type of tablet or computer you are using. You can use a mouse or touchpad to click your choice, you can use the arrow keys on your keyboard, or you can touch your screen if you are using a tablet. You can pick the way that works best for you.

If you have any questions or need help getting started, please ask the adult who is nearby to help you. ","Puedes elegir tus respuestas de diferentes maneras dependiendo del tipo de tableta u ordenador que estés utilizando. Puedes utilizar un ratón o un panel táctil para hacer clic en tu elección, puedes utilizar las teclas de flecha del teclado o puedes tocar la pantalla si utilizas una tableta. Puedes elegir la forma que más te convenga.

Si tienes alguna duda o necesitas ayuda para empezar, pide ayuda al adulto que esté cerca.","Je nach Art des Tablets oder Computers, den du verwendest, kannst du deine Antworten auf unterschiedliche Weise auswählen. Du kannst eine Maus oder ein Touchpad benutzen, um etwas anzuklicken, du kannst die Pfeiltasten auf deiner Tastatur benutzen oder du kannst deinen Bildschirm berühren, wenn du ein Tablet benutzt. Du kannst die Methode wählen, die für dich am besten geeignet ist.

Wenn du Fragen hast oder zum Starten Hilfe brauchst, bitte einen Erwachsenen in deiner Nähe, dir zu helfen. ","Tu peux choisir tes réponses de différentes manières selon le type de tablette ou d'ordinateur que tu utilises. Tu peux utiliser une souris ou un pavé tactile pour cliquer sur ton choix, utiliser les touches fléchées de ton clavier ou toucher l'écran si tu utilises une tablette. Tu peux choisir la méthode qui te convient le mieux.

Si tu as des questions ou si tu as besoin d'aide pour commencer, demande à l'adulte à proximité de t'aider. ","U kunt uw antwoorden op verschillende manieren kiezen, afhankelijk van het type tablet of computer dat u gebruikt. U kunt een muis of touchpad gebruiken om uw keuze te klikken, u kunt de pijltjestoetsen op uw toetsenbord gebruiken of u kunt uw scherm aanraken als u een tablet gebruikt. U kunt de manier kiezen die het beste voor u werkt.

Als u vragen hebt of hulp nodig hebt om te beginnen, vraag dan de volwassene die in de buurt is om u te helpen. ",
task-finished,general,You've completed the game. Thank you!,Has completado el juego. ¡Gracias!,Dieses Spiel ist jetzt zu Ende! Danke fürs Mitmachen!,Tu as terminé le jeu. Merci !,Je hebt het spel voltooid. Bedankt!,
continue-button-text,general,OK,OK,OK,D'accord,OK,
close-button-text,general,Close,Cerrar,Schließen,Fermer,Dichtbij,
general-footer,general,Click the button below or press <b>ANY KEY</b> to continue,Haz clic en el botón abajo o presiona <b>CUALQUIER TECLA</b> para continuar,"Klicke auf die Fläche unten oder drücke eine Beliebige Taste, um fortzufahren",Clique sur le bouton ci-dessous ou appuie sur <b>N'IMPORTE QUELLE TOUCHE</b> pour continuer,Klik op de onderstaande knop of druk op <b>ELKE TOETS</b> om door te gaan,
instructions,general,instructions,instrucciones,Anweisungen,instructions,instructies,
general-encourage,general,Keep Going!,¡Continúa!,Weiter so!,Continuez !,Blijf doorgaan!,
feedbackCorrect,general,Great! That's right.,¡Genial! Eso es correcto.,Großartig! Das ist richtig.,Super ! C'est ça.,Geweldig! Dat klopt.,
feedback-not-quite-right,general,That's not quite right. Please try again.,Eso no está del todo bien. ¡Inténtalo de nuevo!,Das stimmt nicht ganz. Versuch es noch einmal!,That's not quite right. Please try again.,That's not quite right. Please try again.,
feedback-try-again,general,Please try again!,¡Inténtalo de nuevo!,Versuch es noch einmal!,Veuillez essayer à nouveau !,Probeer het opnieuw!,
feedback-good-job,general,Good job!,¡Bien hecho!,Gut gemacht!,Bien joué !,Goed gedaan!,
feedback-nice-work,general,Nice work!,¡Muy bien!,Sehr gut!,Bon travail !,Goed gedaan!,
replay-button,general,Press the speaker button if you want the question repeated.,Presiona el botón del altavoz si deseas que se repita la pregunta.,"Klick auf die Wiederholungstaste, wenn du die Frage nochmal hören willst.",Appuie sur le bouton haut-parleur si tu veux que la question soit répétée.,Druk op de luidsprekerknop als u de vraag wilt herhalen.,
general-fullscreen,general,Switch to full screen mode,Cambiar al modo de pantalla completa,Bitte wechsle in den Vollbildmodus.,Passer en mode plein écran,Overschakelen naar volledig scherm,
general-repeat-instructions,general,Looks like this is a little tricky! Let’s review the instructions.,¡Parece que esto es un poco complicado! Repasemos las instrucciones.,"Das ist ganz schön knifflig! Wir schauen uns nochmal genau an, wie das Spiel geht!",Cela semble un peu compliqué ! Révisons les instructions.,Het lijkt erop dat dit een beetje lastig is! Laten we de instructies nog eens bekijken.,
general-keyboard-instructions,general,"If you want to use your keyboard to answer a question, press the arrow key shown next to your choice.","Si quieres usar el teclado para responder una pregunta, haz click en la flecha que ves al lado de la opción que quieres seleccionar.","Wenn du zum beantworten einer Frage deine Tastatur nutzen möchtest, dann drück einfach die Pfeiltaste auf der Seite, die du wählen möchtest.","Si tu veux utiliser ton clavier pour répondre à une question, appuie sur la touche fléchée indiquée à côté de ton choix.","Als u uw toetsenbord wilt gebruiken om een vraag te beantwoorden, drukt u op de pijltjestoets naast uw keuze.",
intro-finished,general,You've finished the instructions. Thank you!,Has terminado las instrucciones. ¡Gracias!,Das war die Spielanleitung. Vielen Dank!,Tu as terminé les instructions. Merci !,Je hebt de instructies voltooid. Bedankt!,
general-exit,general,Exit,Salir,Spiel verlassen.,Quitter,Uitgang,
task-completion,general,You've completed this game. Thank you!,Has completado el juego. ¡Gracias!,Dieses Spiel ist jetzt zu Ende! Danke fürs Mitmachen!,You've completed this game. Thank you!,You've completed this game. Thank you!,
general-your-turn,general,Nice job with the practice! Let's try some more on your own.,¡Buen trabajo en la práctica! Ahora intenta hacer unos ensayos por tu cuenta.,Das Üben hat schonmal super geklappt! Jetzt kannst du es nochmal alleine versuchen. ,Nice job with the practice! Let's try some more on your own.,Nice job with the practice! Let's try some more on your own.,
matrix-reasoning-instruct1,matrix-reasoning,"We’re going to show you a puzzle, and your job is to pick the best piece to complete the puzzle. Let's get started!",Vamos a mostrarte un rompecabezas. Tu tarea es elegir la mejor pieza para completarlo. ¡Empecemos!,"Wir zeigen dir ein Puzzle, und deine Aufgabe ist es, das beste Teil zu finden, um das Puzzle zu vervollständigen. Los geht's!","Nous allons te montrer un puzzle, et ton travail est de choisir la meilleure pièce pour compléter le puzzle. Commençons !","We gaan je een puzzel laten zien, en jouw taak is om het beste stukje te kiezen om de puzzel compleet te maken. Laten we beginnen!",
matrix-reasoning-instruct2,matrix-reasoning,See this big puzzle? It's missing a piece! Which piece goes in the puzzle?,¿Ves este gran rompecabezas? Le falta una pieza. ¿Cuál pieza va en el rompecabezas?,Siehst du dieses große Puzzle? Es fehlt ein Teil! Welches Teil gehört in das Puzzle?,Vois ce grand puzzle ? Il manque une pièce ! Quelle pièce va dans le puzzle ?,Zie je deze grote puzzel? Er mist een stukje! Welk stukje hoort in de puzzel?,
matrix-reasoning-prompt1,matrix-reasoning,Choose the best pattern to fill in the blank.,Escoge el mejor patrón para llenar el espacio en blanco.,"Wähle das beste Muster, um die Lücke zu füllen.",Choisis le meilleur motif pour remplir le vide.,Kies het beste patroon om de ontbrekende informatie in te vullen.,
mental-rotation,mental-rotation,Do you see these two outlines? One goes with this shape. Let’s see which one goes with the shape.,¿Ves estas dos siluetas? Una va con esta figura. Veamos cuál va con la figura.,"Siehst du diese beiden Schatten? Einer passt zu der Form. Lass uns schauen, welcher zur Form passt.",Tu vois ces deux contours ? L'un va avec cette forme. Voyons lequel va avec la forme. EDIT EDIT.,Zie je deze twee contouren? Eén past bij deze vorm. Laten we eens kijken welke bij de vorm past.,
mental-rotation-training-instruct2,mental-rotation,Let's see if this shape goes with the outline. This shape doesn’t go with the outline.,Veamos si esta figura va con la silueta. Esta figura no va con la silueta.,"Mal sehen, ob diese Form zu dem Schatten passt. Diese Form passt nicht zum Schatten.",Voyons si cette forme va avec le contour. Cette forme ne va pas avec le contour.,Laten we eens kijken of deze vorm bij de omtrek past. Deze vorm past niet bij de omtrek.,
mental-rotation-training-instruct3,mental-rotation,Let's see if this shape goes with the outline. This shape does go with the outline.,Veamos si esta figura va con la silueta. Esta figura sí va con la silueta.,"Mal sehen, ob diese Form zu dem Schatten passt. Diese Form passt zu dem Schatten.",Voyons si cette forme va avec le contour. Cette forme va avec le contour.,Laten we eens kijken of deze vorm bij de omtrek past. Deze vorm past bij de omtrek.,
mental-rotation-test-instruct4,mental-rotation,Now you try! Can you find the shape that goes with the outline?,"¡Ahora, inténtalo tú! ¿Puedes encontrar la figura que va con la silueta?","Jetzt bist du dran! Kannst du die Form finden, die zum Schatten passt?",À toi de jouer ! Peux-tu trouver la forme qui va avec le contour ?,Probeer het nu maar! Kun jij de vorm vinden die bij de omtrek hoort?,
mental-rotation-instruct-3D,mental-rotation,Now you will see pictures that show blocks with three sides. Your task is to choose the matching picture.,Ahora verás unas imágenes de bloques que tienen tres lados. Tu tarea es elegir la imagen que coincide.,"Jetzt siehst du Bilder, die Blöcke mit drei Seiten zeigen.  Deine Aufgabe ist es, das passende Bild auszuwählen.","Maintenant, tu verras des images montrant des blocs avec trois côtés. Ta tâche est de choisir l'image correspondante.",Nu ziet u afbeeldingen die blokken met drie zijden tonen. Uw taak is om de bijpassende afbeelding te kiezen.,
mental-rotation-prompt2,mental-rotation,Choose the picture that matches this one.,Escoge la imagen que coincida con esta.,"Wähle das Bild aus, das hierzu passt.",Choisis l'image qui correspond à celle-ci.,Kies de afbeelding die hierbij past.,
mental-rotation-prompt1,mental-rotation,Choose the matching picture.,Escoge la imagen que coincide.,Wähle das passende Bild aus.,Choisissez l'image correspondante.,Kies de bijpassende afbeelding.,
math-instructions1,math,"In this game, you will do some math problems. Some will be like the ones you do in school and some will be a little different than what you do in school. 

Some questions might be easy for you and some might be hard. That is okay! Please try your best and take your time. Most of the questions will have four choices. You choose the one you think is right. Let’s get started!","En este juego, harás algunos problemas de matemáticas. Algunos serán como los que haces en la escuela y otros serán un poco diferentes de los que haces en la escuela. 

Algunas preguntas te resultarán fáciles y otras difíciles. ¡No pasa nada! Esfuérzate al máximo y tómate tu tiempo. La mayoría de las preguntas tienen cuatro opciones. Elige la que consideres correcta. ¡Empecemos!","In diesem Spiel wirst du einige mathematische Aufgaben lösen. Einige sind wie die, die du in der Schule machst, und einige sind etwas anders als die, die du in der Schule machst. 

Einige Fragen könnten leicht für dich sein und einige könnten schwer sein. Das ist nicht schlimm! Bitte gib dein Bestes und nimm dir Zeit. Bei den meisten Fragen gibt es vier Auswahlmöglichkeiten. Du wählst die aus, die du für richtig hältst. Los geht's!","In this game, you will do some math problems. Some will be like the ones you do in school and some will be a little different than what you do in school. 

Some questions might be easy for you and some might be hard. That is okay! Please try your best and take your time. Most of the questions will have four choices. You choose the one you think is right. Let’s get started!","In this game, you will do some math problems. Some will be like the ones you do in school and some will be a little different than what you do in school. 

Some questions might be easy for you and some might be hard. That is okay! Please try your best and take your time. Most of the questions will have four choices. You choose the one you think is right. Let’s get started!",
math-intro1,math,Here is the first section of the game. Let's start with some practice!,Esta es la primera sección. ¡Empecemos a practicar!,Hier kommt der erste Teil. Am Anfang üben wir erstmal nur.,Here is the first section. Let's start with some practice!,Here is the first section. Let's start with some practice!,
math-intro2,math,Here is another section. The first few are for practice.,Esta es otra sección. Las primeras son para practicar.,Jetzt kommt der nächste Teil. Die ersten paar sind wieder zum Üben.,Here is another section. The first few are for practice.,Here is another section. The first few are for practice.,
math-intro-fractions,math,In this section sometimes you will add and sometimes you will subtract. Be sure to look carefully for the plus or minus sign. The first few are for practice.,En esta sección a veces tienes que sumar y a veces tienes que restar. Fíjate bien en el signo de suma o resta. Los primeros son para practicar.,"In diesem Teil musst du manchmal addieren und manchmal subtrahieren. Schau also genau, ob da ein Plus oder ein Minus steht. Die ersten paar sind wieder zum Üben.",In this section sometimes you will add and sometimes you will subtract. Be sure to look carefully for the plus or minus sign. The first few are for practice.,In this section sometimes you will add and sometimes you will subtract. Be sure to look carefully for the plus or minus sign. The first few are for practice.,
number-comparison-prompt1,math,Which number is larger?,¿Cuál número es mayor?,Welche Zahl ist größer?,Quel nombre est plus grand ?,Welk getal is groter?,
number-comparison-prompt2,math,Which is larger?,¿Cuál es mayor?,Welche ist größer?,Lequel est plus grand ?,Welke is groter?,
number-identification-prompt1,math,Choose the number you hear.,Escoge el número cuando lo escuches.,"Wähle die Zahl, die du hörst.",Choisis le numéro que tu entends.,Kies het nummer dat je hoort.,
missing-number-prompt1,math,What number goes in the blank?,¿Cuál número va en el espacio en blanco?,Welche Zahl gehört in die Lücke?,Quel nombre va dans l'espace vide ?,Welk getal moet er op de lege plek komen?,
missing-number-prompt2,math,What number goes here?,¿Cuál número va aquí?,Welche Zahl gehört hierher?,Quel nombre va ici ?,Welk getal hoort hier?,
missing-number-prompt3,math,What numbers go in the blanks?,¿Cuál números van en los espacios en blanco?,Welche Zahlen gehören in die Lücken?,What numbers go in the blanks?,What numbers go in the blanks?,
addition-prompt1,math,Add the numbers and choose the correct answer.,Suma los números y escoge la respuesta correcta.,Addiere die Zahlen und wähle die richtige Antwort.,Ajoute les chiffres et choisis la réponse correcte.,Tel de getallen op en kies het juiste antwoord.,
addition-prompt2,math,Add the numbers.,Suma los números.,Addiere die Zahlen. ,Ajoute les chiffres.,Tel de getallen op.,
subtraction-prompt1,math,Subtract the numbers and choose the correct answer.,Resta los números y escoge la respuesta correcta.,Ziehe die Zahlen ab und wähle die richtige Antwort.,Soustrais les chiffres et choisis la réponse correcte.,Trek de getallen van elkaar af en kies het juiste antwoord.,
subtraction-prompt2,math,Subtract the numbers.,Resta los números.,Ziehe die Zahlen ab. ,Soustrais les chiffres.,Trek de getallen van elkaar af.,
multiplication-prompt1,math,Multiply the numbers and choose the correct answer.,Multiplica los números y escoge la respuesta correcta.,Multipliziere die Zahlen und wähle die richtige Antwort.,Multiplie les chiffres et choisis la réponse correcte.,Vermenigvuldig de getallen en kies het juiste antwoord.,
multiplication-prompt2,math,Multiply the numbers.,Multiplica los números.,Multipliziere die Zahlen. ,Multiplie les chiffres.,Vermenigvuldig de getallen.,
number-line-instruct1,math,Here is a number line. You can move the slider forward and backward along the line. Move the slider so it is in the right place to show where the number belongs. Make sure you look at the numbers at each end when deciding where to move the slider.,Aquí tienes una recta numérica. Sobre ella hay un marcador que tu puedes mover hacia la derecha o izquierda. Tu debes ubicar este marcador en el lugar de la recta donde estaría ubicado el número que te indicará cada ejercicio. Asegúrate de revisar bien cuáles son los números de los extremos de la recta antes de decidir dónde ubicar el marcador. ,"Hier ist eine Zahlenreihe. Du kannst den Schieber vorwärts und rückwärts entlang der Linie bewegen. Ändere den Schieber so, dass er sich an der richtigen Stelle befindet, um zu zeigen, wo die Zahl hingehört. Achte darauf, dass du die Zahlen an beiden Enden ansiehst, wenn du entscheidest, wohin du den Schieber platzierst. ",Here is a number line. You can move the slider forward and backward along the line. Move the slider so it is in the right place to show where the number belongs. Make sure you look at the numbers at each end when deciding where to move the slider.,Here is a number line. You can move the slider forward and backward along the line. Move the slider so it is in the right place to show where the number belongs. Make sure you look at the numbers at each end when deciding where to move the slider.,
number-line-prompt1,math,Choose the number that is marked on the number line.,Escoge el número que está marcado en la recta numérica.,"Wähle die Zahl, die auf der Zahlenreihe markiert ist.",Choisis le chiffre qui est marqué sur la ligne numérique.,Kies het getal dat op de getallenlijn staat.,
number-line-slider-prompt1,math,Move the slider to mark the number.,Ubica el marcador sobre la recta numérica para marcar el lugar del número.,Bewege den Schieber auf die angegebene Zahl.,Move the slider to mark the number.,Move the slider to mark the number.,
number-identification-1,math,Choose the number 1.,Escoge el número 1.,Wähle die Zahl Eins.,Choisis le numéro 1.,Kies het getal 1.,
number-identification-2,math,Choose the 2.,Escoge el 2.,Wähle die Zwei.,Choisis le 2.,Kies de 2.,
number-identification-3,math,Choose the 9.,Escoge el 9.,Wähle die Neun.,Choisis le 9.,Kies de 9.,
number-identification-4,math,Choose the 0.,Escoge el 0.,Wähle die Null.,Choisis le 0.,Kies de 0.,
number-identification-5,math,Choose the 12.,Escoge el 12.,Wähle die Zwölf.,Choisis le 12.,Kies de 12.,
number-identification-6,math,Choose the 30.,Escoge el 30.,Wähle die Dreißig.,Choisis le 30.,Kies de 30.,
number-identification-7,math,Choose the 22.,Escoge el 22.,Wähle die  Zweiundzwanzig.,Choisis le 22.,Kies de 22.,
number-identification-8,math,Choose the 45.,Escoge el 45.,Wähle die  Fünfundvierzig.,Choisis le 45.,Kies de 45.,
number-identification-9,math,Choose the 39.,Escoge el 39.,Wähle die  Neununddreißig.,Choisis le 39.,Kies de 39.,
number-identification-10,math,Choose the 23.,Escoge el 23.,Wähle die  Dreiundzwanzig.,Choisis le 23.,Kies de 23.,
number-identification-11,math,Choose the 48.,Escoge el 48.,Wähle die  Achtundvierzig.,Choisis le 48.,Kies de 48.,
number-identification-12,math,Choose the 91.,Escoge el 91.,Wähle die  91.,Choisis le 91.,Kies de 91.,
number-identification-13,math,Choose the 33.,Escoge el 33.,Wähle die  Dreiunddreißig.,Choisis le 33.,Kies de 33.,
number-identification-14,math,Choose the 74.,Escoge el 74.,Wähle die  Vierundsiebzig.,Choisis le 74.,Kies de 74.,
number-identification-15,math,Choose the 87.,Escoge el 87.,Wähle die  Siebenundachzig.,Choisis le 87.,Kies de 87.,
number-identification-16,math,Choose the 65.,Escoge el 65.,Wähle die  65.,Choisis le 65.,Kies de 65.,
number-identification-17,math,Choose the 108.,Escoge el 108.,Wähle die  Einhundertacht.,Choisis le 108.,Kies de 108.,
number-identification-18,math,Choose the 245.,Escoge el 245.,Wähle die  Zweihundertfünfundvierzig.,Choisis le 245.,Kies de 245.,
number-identification-19,math,Choose the 587.,Escoge el 587.,Wähle die  Fünfhundertsiebenundachzig.,Choisis le 587.,Kies de 587.,
number-identification-20,math,Choose the 731.,Escoge el 731.,Wähle die  Siebenhunderteinunddreißig.,Choisis le 731.,Kies de 731.,
number-identification-21,math,Choose the 989.,Escoge el 989. ,Wähle die  Neunhundertneunundachzig.,Choisis le 989.,Kies de 989.,
number-identification-22,math,Choose the 6.,Escoge el 6.,Wähle die sechs.,Choisis le 6.,Choose the 6.,
number-identification-23,math,Choose the 14.,Escoge el 14.,Wähle die vierzehn.,Choisis le 14.,Choose the 14.,
number-identification-24,math,Choose the 18.,Escoge el 18.,Wähle die achtzehn.,Choisis le 18.,Choose the 18.,
number-identification-25,math,Choose the 26.,Escoge el 26.,Wähle die sechsundzwanzig.,Choisis le 26.,Choose the 26.,
