,item_id,labels,en,es-CO,de,fr
595,trog-item-24,trog,the lady is carrying the bag,the lady is carrying the bag,the lady is carrying the bag,la dame porte le sac
596,trog-item-25,trog,they are sitting on the table,they are sitting on the table,they are sitting on the table,ils sont assis sur la table
597,trog-item-26,trog,the cow is looking at them,the cow is looking at them,the cow is looking at them,la vache les regarde
598,trog-item-27,trog,they are jumping over the wall,they are jumping over the wall,they are jumping over the wall,ils sautent par-dessus le mur
599,trog-item-28,trog,the elephant is carrying them,the elephant is carrying them,the elephant is carrying them,l'éléphant les porte
600,trog-item-29,trog,the girl is pushing the horse,the girl is pushing the horse,the girl is pushing the horse,la fille pousse le cheval
601,trog-item-30,trog,the boy is chasing the sheep,the boy is chasing the sheep,the boy is chasing the sheep,le garçon chasse les moutons
602,trog-item-31,trog,the man is chasing the dog,the man is chasing the dog,the man is chasing the dog,l'homme traque le chien
603,trog-item-32,trog,the cow is pushing the lady,the cow is pushing the lady,the cow is pushing the lady,la vache pousse la dame
604,trog-item-33,trog,she is sitting on the chair,she is sitting on the chair,she is sitting on the chair,elle est assise sur la chaise
605,trog-item-34,trog,the lady is carrying him,the lady is carrying him,the lady is carrying him,la dame le porte
606,trog-item-35,trog,he is sitting in the tree,he is sitting in the tree,he is sitting in the tree,il est assis dans l'arbre
607,trog-item-36,trog,the horse is looking at her,the horse is looking at her,the horse is looking at her,le cheval la regarde
608,trog-item-37,trog,the cats look at the ball,the cats look at the ball,the cats look at the ball,les chats regardent la boule
609,trog-item-38,trog,the boy stands on the chairs,the boy stands on the chairs,the boy stands on the chairs,le garçon se tient sur les chaises
610,trog-item-39,trog,the boys pick the apples,the boys pick the apples,the boys pick the apples,les garçons choisissent les pommes
611,trog-item-40,trog,the girl drops the cups,the girl drops the cups,the girl drops the cups,la fille lâche les tasses
612,trog-item-41,trog,the fork is longer than the pencil,the fork is longer than the pencil,the fork is longer than the pencil,la fourche est plus longue que le crayon
613,trog-item-42,trog,the box is bigger than the cup,the box is bigger than the cup,the box is bigger than the cup,la boîte est plus grande que la tasse
614,trog-item-43,trog,the shoe is bigger than the bird,the shoe is bigger than the bird,the shoe is bigger than the bird,la chaussure est plus grande que l'oiseau
615,trog-item-44,trog,the horse is taller than the wall,the horse is taller than the wall,the horse is taller than the wall,le cheval est plus grand que le mur
616,trog-item-45,trog,the girl is chased by the horse,the girl is chased by the horse,the girl is chased by the horse,la fille est chassée par le cheval
617,trog-item-46,trog,the elephant is pushed by the boy,the elephant is pushed by the boy,the elephant is pushed by the boy,l'éléphant est poussé par le garçon
618,trog-item-47,trog,the horse is chased by the man,the horse is chased by the man,the horse is chased by the man,le cheval est chassé par l'homme
619,trog-item-48,trog,the cow is pushed by the man,the cow is pushed by the man,the cow is pushed by the man,la vache est poussée par l'homme
620,trog-item-49,trog,the cup is in the box,the cup is in the box,the cup is in the box,le gobelet est dans la boîte
621,trog-item-50,trog,the pencil is on the box,the pencil is on the box,the pencil is on the box,le crayon est sur la boîte
622,trog-item-51,trog,the circle is in the star,the circle is in the star,the circle is in the star,le cercle est dans l'étoile
623,trog-item-52,trog,the fork is on the shoe,the fork is on the shoe,the fork is on the shoe,la fourchette est à la chaussure
624,trog-item-53,trog,the boy chasing the horse is tall,the boy chasing the horse is tall,the boy chasing the horse is tall,le garçon poursuivant le cheval est grand
625,trog-item-54,trog,the pencil on the shoe is blue,the pencil on the shoe is blue,the pencil on the shoe is blue,le crayon sur la chaussure est bleu
626,trog-item-55,trog,the cow chasing the cat is brown,the cow chasing the cat is brown,the cow chasing the cat is brown,la vache chassant le chat est brun
627,trog-item-56,trog,the circle in the star is yellow,the circle in the star is yellow,the circle in the star is yellow,le cercle dans l'étoile est jaune
628,trog-item-57,trog,the box but not the chair is red,the box but not the chair is red,the box but not the chair is red,la boîte mais pas la chaise est rouge
629,trog-item-58,trog,the cat is big but not black,the cat is big but not black,the cat is big but not black,le chat est grand mais pas noir
630,trog-item-59,trog,the horse but not the boy is standing,the horse but not the boy is standing,the horse but not the boy is standing,le cheval mais pas le garçon est debout
631,trog-item-60,trog,the boy is sitting but not eating,the boy is sitting but not eating,the boy is sitting but not eating,le garçon est assis mais ne mange pas
632,trog-item-61,trog,the pencil is above the flower,the pencil is above the flower,the pencil is above the flower,le crayon est au-dessus de la fleur
633,trog-item-62,trog,the comb is below the spoon,the comb is below the spoon,the comb is below the spoon,le peigne est sous la cuillère
634,trog-item-63,trog,the star is above the circle,the star is above the circle,the star is above the circle,l'étoile est au-dessus du cercle
635,trog-item-64,trog,the square is below the star,the square is below the star,the square is below the star,le carré est en dessous de l'étoile
636,trog-item-65,trog,not only the bird but also the flower is blue,not only the bird but also the flower is blue,not only the bird but also the flower is blue,non seulement l'oiseau mais aussi la fleur est bleue
637,trog-item-66,trog,the box is not only big but also blue,the box is not only big but also blue,the box is not only big but also blue,"la boîte est non seulement grande, mais aussi bleue"
638,trog-item-67,trog,not only the girl but also the cat is sitting,not only the girl but also the cat is sitting,not only the girl but also the cat is sitting,"non seulement la fille, mais aussi le chat est assis"
639,trog-item-68,trog,the girl has not only food but also a drink,the girl has not only food but also a drink,the girl has not only food but also a drink,"la fille a non seulement de la nourriture, mais aussi une boisson"
640,trog-item-69,trog,the pencil is on the book that is yellow,the pencil is on the book that is yellow,the pencil is on the book that is yellow,le crayon est sur le livre jaune
641,trog-item-70,trog,the girl chases the dog that is big,the girl chases the dog that is big,the girl chases the dog that is big,la fille traque le chien qui est grand
642,trog-item-71,trog,the square is in the star that is blue,the square is in the star that is blue,the square is in the star that is blue,le carré est dans l'étoile bleue
643,trog-item-72,trog,the dog chases the horse that is brown,the dog chases the horse that is brown,the dog chases the horse that is brown,le chien poursuit le cheval qui est brun
644,trog-item-73,trog,neither the dog nor the ball is brown,neither the dog nor the ball is brown,neither the dog nor the ball is brown,ni le chien ni la boule ne sont bruns
645,trog-item-74,trog,the pencil is neither long nor red,the pencil is neither long nor red,the pencil is neither long nor red,le crayon n'est ni long ni rouge
646,trog-item-75,trog,neither the boy nor the horse is running,neither the boy nor the horse is running,neither the boy nor the horse is running,ni le garçon ni le cheval ne courent
647,trog-item-76,trog,the boy has neither hat nor shoes,the boy has neither hat nor shoes,the boy has neither hat nor shoes,le garçon n'a ni chapeau ni chaussures
648,trog-item-77,trog,the book the pencil is on is red,the book the pencil is on is red,the book the pencil is on is red,le livre sur lequel le crayon est est rouge
649,trog-item-78,trog,the cat the cow chases is black,the cat the cow chases is black,the cat the cow chases is black,le chat que la vache chase est noir
650,trog-item-79,trog,the circle the star is in is red,the circle the star is in is red,the circle the star is in is red,le cercle dans lequel se trouve l'étoile est rouge
651,trog-item-80,trog,the boy the dog chases is big,the boy the dog chases is big,the boy the dog chases is big,le garçon que le chien chasse est grand
652,trog-item-81,trog,the horse drank water by the barn and the sheep ate grass by the fence,the horse drank water by the barn and the sheep ate grass by the fence,the horse drank water by the barn and the sheep ate grass by the fence,le cheval buvait de l'eau près de la grange et le mouton mangeait de l'herbe par la clôture
653,trog-item-82,trog,the student opened the notebook and drew a tree,the student opened the notebook and drew a tree,the student opened the notebook and drew a tree,l'élève a ouvert le bloc-notes et dessiné un arbre
654,trog-item-83,trog,we will have a picnic in the park if it is sunny,we will have a picnic in the park if it is sunny,we will have a picnic in the park if it is sunny,nous aurons un pique-nique dans le parc si c'est ensoleillé
655,trog-item-84,trog,he found his keys under the couch with the pillows,he found his keys under the couch with the pillows,he found his keys under the couch with the pillows,il a trouvé ses clés sous le canapé avec les oreillers
656,trog-item-85,trog,she is the gardener who wears the hat that has a flower,she is the gardener who wears the hat that has a flower,she is the gardener who wears the hat that has a flower,elle est le jardinier qui porte le chapeau qui a une fleur
657,trog-item-86,trog,She tripped on a rock and dropped her books.,She tripped on a rock and dropped her books.,She tripped on a rock and dropped her books.,Elle se glissa sur un rocher et lâcha ses livres.
658,trog-item-87,trog,The teacher will give the students cake if they stand in a line.,The teacher will give the students cake if they stand in a line.,The teacher will give the students cake if they stand in a line.,L'enseignant donnera aux élèves un gâteau s'ils se tiennent dans une ligne.
659,trog-item-88,trog,We will dance together if there is music playing.,We will dance together if there is music playing.,We will dance together if there is music playing.,Nous danserons ensemble s'il y a de la musique.
660,trog-item-89,trog,"Although it is hot outside, I am wearing a jacket with a hood.","Although it is hot outside, I am wearing a jacket with a hood.","Although it is hot outside, I am wearing a jacket with a hood.","Bien qu'il soit chaud à l'extérieur, je porte une veste avec une capuche."
661,trog-item-90,trog,"He likes swimming. However, he chose to play soccer with his friends.","Le gusta nadar. Sin embargo, elijió jugar fútbol con sus amigos.","Er schwimmt gerne, aber er hat sich entschieden, mit seinen Freunden Fußball zu spielen.","Il aime la natation, mais il a choisi de jouer au football avec ses amis."
662,trog-item-91,trog,"Despite the noise in the classroom, she focused on reading her notebook.","Despite the noise in the classroom, she focused on reading her notebook.","Despite the noise in the classroom, she focused on reading her notebook.","Malgré le bruit dans la salle de classe, elle s'est concentrée sur la lecture de son cahier."
663,trog-item-92,trog,He wore the clown's hat despite its large size.,He wore the clown's hat despite its large size.,He wore the clown's hat despite its large size.,Il portait le chapeau du clown malgré sa grande taille.
664,trog-item-93,trog,The duck following the turtle is walking across the bridge.,The duck following the turtle is walking across the bridge.,The duck following the turtle is walking across the bridge.,Le canard qui suit la tortue se promène sur le pont.
665,trog-item-94,trog,Bumping the table with my foot caused a book to fall.,Bumping the table with my foot caused a book to fall.,Bumping the table with my foot caused a book to fall.,"En poussant la table avec mon pied, un livre a chuté."
666,trog-item-95,trog,The person chases the dog that is big.,The person chases the dog that is big.,The person chases the dog that is big.,La personne traque le chien qui est grand.
667,trog-item-96,trog,The girl wearing a backpack was shown a flower by her friend.,A la niña que llevaba el morral su amiga le mostró una flor.,"Dem Mädchen, das einen Rucksack trägt, wurde von seiner Freundin eine Blume gezeigt.",La jeune fille portant un sac à dos a été montrée une fleur par son ami.
668,trog-item-97,trog,"The kids cleaned the room, but forgot to put away the train.","The kids cleaned the room, but forgot to put away the train.","The kids cleaned the room, but forgot to put away the train.","Les enfants ont nettoyé la chambre, mais ils ont oublié de ranger le train."
669,trog-item-98,trog,The monkey neither ate the banana nor swung on the vine.,El mono no se comió el plátano ni se columpió en la liana.,Der Affe hat weder die Banane gegessen noch sich an der Liane geschwungen.,Le singe n'a ni mangé la banane ni basculé sur la vigne.
670,trog-item-99,trog,"Her mom said it would be sunny. However, it rained heavily.","Her mom said it would be sunny. However, it rained heavily.","Her mom said it would be sunny. However, it rained heavily.","Sa mère a dit que ce serait du soleil, mais il a beaucoup pleuré."
671,trog-item-100,trog,The plane that is gray is above the clouds.,The plane that is gray is above the clouds.,The plane that is gray is above the clouds.,Le plan qui est gris est au-dessus des nuages.
672,trog-item-101,trog,The fish swim beneath a whale and a sea turtle.,The fish swim beneath a whale and a sea turtle.,The fish swim beneath a whale and a sea turtle.,Le poisson nage sous une baleine et une tortue de mer.
673,trog-item-102,trog,The car that the truck followed is driving toward the tunnel.,The car that the truck followed is driving toward the tunnel.,The car that the truck followed is driving toward the tunnel.,La voiture que le camion a suivie se dirige vers le tunnel.
674,trog-item-103,trog,Instead of doing homework she did a puzzle in her room.,Instead of doing homework she did a puzzle in her room.,Instead of doing homework she did a puzzle in her room.,"Au lieu de faire des devoirs, elle a fait un puzzle dans sa chambre."
675,yes,theory-of-mind,yes,sí,ja,Oui
676,no,theory-of-mind,no,no,nein,non
677,happy,theory-of-mind,happy,feliz,glücklich,heureux
678,sad,theory-of-mind,sad,triste,traurig,triste
679,angry,theory-of-mind,angry,enojado,wütend,en colère
680,scared,theory-of-mind,scared,asustado,ängstlich,effrayé
681,calm,theory-of-mind,calm,tranquilo,ruhig,calme
682,proud,theory-of-mind,proud,orgulloso,stolz,fier
683,disgusted,theory-of-mind,disgusted,asqueado,angeekelt,dégoûté
684,surprised,theory-of-mind,surprised,sorprendido,überrascht,surprise
685,ToM-intro,theory-of-mind,"This is the Stories Game. In this game, you will listen to some stories. Then you will answer questions about the stories.",Este es el Juego de las historias. En este juego vas a escuchar algunas historias y luego vas a responder preguntas sobre esas historias.,Das ist das Geschichten-Spiel. In diesem Spiel wirst du Geschichten hören und dann kannst du ein paar Fragen dazu beantworten.,"Il s'agit du jeu Historiques. Dans ce jeu, vous écouterez quelques histoires. Vous pourrez ensuite répondre à des questions sur les histoires."
686,ToM-transition,theory-of-mind,Nice work! Here is a new story.,¡Bien hecho! Ahora vamos con una nueva historia.,Sehr gut! Hier ist eine neue Geschichte.,Beau travail! Voici une nouvelle histoire.
687,ToM-scene1-instruct1,theory-of-mind,"Here is Madison. This morning, Madison put her book behind the chair, because she didn’t want anyone to find it. ","Here is Madison. This morning, Madison put her book behind the chair, because she didn’t want anyone to find it. ","Here is Madison. This morning, Madison put her book behind the chair, because she didn’t want anyone to find it. ","Voici Madison : ce matin, Madison a mis son livre derrière la chaise, parce qu’elle ne voulait pas que quelqu’un le trouve. "
688,ToM-scene1-instruct2,theory-of-mind,"But when Madison was outside playing, someone did find it! And hid it under the rug. ","But when Madison was outside playing, someone did find it! And hid it under the rug. ","But when Madison was outside playing, someone did find it! And hid it under the rug. ","Mais quand Madison était en dehors de jouer, quelqu'un l'a trouvé, et l'a caché sous le tapis. "
689,ToM-scene1-instruct3,theory-of-mind,So now it’s reading time and Madison wants her book.,So now it’s reading time and Madison wants her book.,So now it’s reading time and Madison wants her book.,Il est maintenant temps de lire et Madison veut son livre.
690,ToM-scene1-q1-false_belief,theory-of-mind,Where will Madison look first for her book?,¿Dónde buscará Marisol su libro primero?,Wo wird Laura zuerst nach ihrem Buch suchen? ,Où Madison va-t-elle chercher le premier livre ?
691,chair,theory-of-mind,Behind the chair,Detrás de la silla,Hinter dem Stuhl,Derrière la chaise
692,rug,theory-of-mind,Under the rug,Debajo de la alfombra,Unter dem Teppich,Sous le tapis
693,ToM-scene1-q2-reality_check,theory-of-mind,And where is her book really?,¿Y dónde está realmente su libro?,Und wo ist ihr Buch wirklich?,Et où est vraiment son livre ?
694,ToM-scene2-instruct1,theory-of-mind,"This morning when he came to school, Ethan put his book on the shelf above the coat hooks. Ethan’s book is blue! ","Esta mañana, cuando vino a la escuela, Elián puso su libro sobre la repisa encima de los colgaderos de abrigos. El libro de Elián es azul.","Heute Morgen, als er in die Schule kam, hat Justus sein Buch auf die Garderobe über den Mänteln gelegt. Das Buch von Justus ist blau! ","Ce matin, quand il est venu à l'école, Ethan a mis son livre sur l'étagère au-dessus des crochets de manteau, le livre d'Ethan est bleu! "
695,ToM-scene2-instruct2,theory-of-mind,"And then he went outside to play, see? Here’s Ethan playing outside. And while he was outside playing, Ethan’s book fell down from above the coat hooks onto the floor under the coats, see? ","Y luego salió a jugar, ¿ves? Aquí está Elián jugando afuera. Mientras Elián estaba afuera jugando, su libro se cayó de la repisa y quedó en el piso, debajo de los abrigos, ¿ves?","Und dann ist er nach draußen gegangen, um zu spielen, siehst du? Hier ist Justus beim Spielen draußen. Und während er draußen spielte, fiel das Buch von Justus von der Garderobe auf den Boden unter die Mäntel, siehst du? ","Et puis il est sorti pour jouer, voir? Voici Ethan jouer dehors. Et pendant qu’il était en dehors du jeu, le livre d’Ethan est tombé du haut des crochets sur le plancher sous les manteaux, voir ? "
696,ToM-scene2-instruct3,theory-of-mind,"Then Hannah comes in and Hannah puts her book up above the coat hooks. Hannah's book is also blue! Ethan is still outside playing, so he didn't see what Hannah was doing.","Luego entró Ana y puso su libro sobre la repisa encima de los colgaderos. ¡El libro de Ana también es azul! Como Elián todavía está afuera jugando, no vio lo que hizo Ana.","Dann kommt Hannah herein und legt ihr Buch auf die Garderobe über den Mänteln. Hannahs Buch ist auch blau! Justus ist noch draußen und spielt, deshalb hat er nicht gesehen, was Hannah gemacht hat.","Puis Hannah entre et Hannah met son livre au-dessus des crochets de manteau. Le livre de Hannah est aussi bleu! Ethan est encore en dehors de jouer, donc il n'a pas vu ce que faisait Hannah."
697,ToM-scene2-q1-false_belief,theory-of-mind,"Now, when Ethan comes in from outside, where will he look first for his book?","Entonces, cuando Elián regrese, ¿dónde buscará primero su libro?","Wenn Justus nun von draußen hereinkommt, wo wird er zuerst nach seinem Buch suchen?","Maintenant, quand Ethan viendra de l'extérieur, où va-t-il chercher son livre en premier?"
698,shelf,theory-of-mind,On the shelf,Sobre la repisa,Oben im Regal,Sur l'étagère
699,coats,theory-of-mind,Under the coats,Debajo de los abrigos,Unter den Mänteln,Sous les manteaux
700,ToM-scene2-instruct4,theory-of-mind,"Let’s see what he does. Oh look, here is Ethan reaching for this book up on the shelf. And now Hannah sees Ethan reaching for that book... the book that is Hannah's!","Veamos lo que Elián hace. Oh, mira, Elián está cogiendo el libro que está sobre la repisa. Y ahora Ana ve a Elián cogiendo ese libro... ¡el libro que es de Ana!","Mal sehen, was er macht. Oh, sieh mal, da ist Justus. Er greift nach dem Buch oben im Regal. Und jetzt sieht Hannah, wie Justus nach dem Buch greift... dem Buch, das Hannah gehört!","Voyons ce qu'il fait. Oh, regardez, voici Ethan pour atteindre ce livre sur l'étagère. Et maintenant, Hannah voit Ethan atteindre pour ce livre... le livre qui est celui d'Hannah!"
701,ToM-scene2-q2-emotion_reasoning,theory-of-mind,How do you think Hannah feels about Ethan reaching for that book? ,¿Cómo crees que se siente Ana cuando Elián coge ese libro?,"Was glaubst du, was Hannah davon hält, dass Justus nach dem Buch greift? ",Que pensez-vous qu'Hannah se sent pour Ethan d'atteindre ce livre? 
702,ToM-scene2-q7-emotion_reasoning,theory-of-mind,How do you think Hannah would feel if she had not seen Ethan reaching for the book?,¿Cómo crees que se sentiría Ana si no hubiera visto a Elián coger el libro?,"Wie würde sich Hannah wohl fühlen, wenn sie nicht gesehen hätte, wie Justus nach dem Buch greift?",Comment pensez-vous qu'Hannah se sentirait si elle n'avait pas vu Ethan atteindre le livre?
703,ToM-scene2-q3-false_belief,theory-of-mind,Is Ethan being mean and naughty for taking Hannah's book?,¿Elián está siendo malo y travieso al tomar el libro de Ana?,"Ist es gemein und frech von Justus, dass er Hannahs Buch genommen hat?",Est-ce que Ethan est méchant et méchant pour avoir pris le livre d'Hannah?
704,ToM-scene2-q4-false_belief,theory-of-mind,Should Ethan get in trouble with the teacher for taking Hannah's book?,¿Debería Elián estar en problemas con el maestro por tomar el libro de Ana?,"Sollte Justus Ärger mit der Lehrerin bekommen, weil er Hannahs Buch genommen hat?",Ethan doit-il se mettre en difficulté avec le professeur pour avoir pris le livre de Hannah?
705,ToM-scene2-q5-reality_check,theory-of-mind,Can you help Hannah find her book? Is it on the shelf or under the coats?,¿Puedes ayudar a Ana a encontrar su libro? ¿Está sobre la repisa o debajo de los abrigos?,"Kannst du Hannah helfen, ihr Buch zu finden? Ist es auf dem Regal oder unter den Mänteln?","Vous pouvez aider Hannah à trouver son livre, sur l'étagère ou sous les manteaux?"
706,ToM-scene2-q6-reality_check,theory-of-mind,Can you help Ethan find his book? Is it on the shelf or under the coats?,¿Puedes ayudar a Elián a encontrar su libro? ¿Está sobre la repisa o debajo de los abrigos?,"Kannst du Justus helfen, sein Buch zu finden? Ist es auf dem Regal oder unter den Mänteln?",Pouvez-vous aider Ethan à trouver son livre ?
707,ToM-scene3-instruct1,theory-of-mind,"Joshua, Isabel, and Ivan are playing a game. Here's how the game goes: One kid hides, but draws a clue in the sandbox so the other kids can find them. ","Joshua, Isabel, and Ivan are playing a game. Here's how the game goes: One kid hides, but draws a clue in the sandbox so the other kids can find them. ","Joshua, Isabel, and Ivan are playing a game. Here's how the game goes: One kid hides, but draws a clue in the sandbox so the other kids can find them. ","Joshua, Isabel et Ivan jouent à un jeu. Voici comment se déroule le jeu: un enfant se cache, mais dessine un indice dans le bac à sable pour que les autres enfants puissent les trouver. "
708,ToM-scene3-instruct2,theory-of-mind,"So Ivan is going first. He draws this clue in the sandbox, and then he goes to hide. ","So Ivan is going first. He draws this clue in the sandbox, and then he goes to hide. ","So Ivan is going first. He draws this clue in the sandbox, and then he goes to hide. ","Ivan va donc en premier. Il dessine cet indice dans le bac à sable, puis il va se cacher. "
709,ToM-scene3-instruct3,theory-of-mind,"Now it's Joshua's turn to leave a clue, and hide. Isabel and Ivan will then try to use the clue to find him.","Now it's Joshua's turn to leave a clue, and hide. Isabel and Ivan will then try to use the clue to find him.","Now it's Joshua's turn to leave a clue, and hide. Isabel and Ivan will then try to use the clue to find him.",C'est maintenant au tour de Josué de laisser un indice et de se cacher. Isabel et Ivan essaieront alors d'utiliser l'indice pour le trouver.
