item_id,task,en-US,es-AR,es-CO,de-DE,ar-IL,en-GB,eo-UY,he-IL,nl-NL,pt-BR
same-different-selection-both-triangles,same-different-selection,Here are two cards. These cards are the same in one way. They are both triangles.,Aquí hay dos cartas. Estas cartas son iguales en algo. Las dos son triángulos.,NO APPROVED TRANSLATION,NO APPROVED TRANSLATION,NO APPROVED TRANSLATION,Here are two cards. These cards are the same in one way. They are both triangles.,Jen du kartoj. Tiuj kartoj estas samaj iel. Ili ambaŭ estas trianguloj.,NO APPROVED TRANSLATION,Hier zijn twee kaarten. Deze kaarten zijn op één manier hetzelfde. Ze zijn allebei driehoeken.,
same-different-selection-both-triangles-heavy,same-different-selection,Here are two pictures. Something's the same. They're both triangles.,,Aquí hay dos imágenes. Algo es igual. Ambas son triángulos.,Hier sind zwei Bilder. Etwas ist gleich. Beide sind Dreiecke.,NO APPROVED TRANSLATION,,,NO APPROVED TRANSLATION,,
same-different-selection-both-yellow,same-different-selection,Here are two cards. These cards are the same in one way. They are both yellow.,Aquí hay dos cartas. Estas cartas son iguales en algo. Las dos son amarillas.,NO APPROVED TRANSLATION,NO APPROVED TRANSLATION,NO APPROVED TRANSLATION,Here are two cards. These cards are the same in one way. They are both yellow.,Jen du kartoj. Tiuj kartoj estas samaj iel. Ili ambaŭ estas flavaj.,NO APPROVED TRANSLATION,Hier zijn twee kaarten. Deze kaarten zijn op één manier hetzelfde. Ze zijn allebei geel.,
same-different-selection-both-yellow-heavy,same-different-selection,Here are two pictures. Something's the same. They're both yellow.,,Aquí hay dos imágenes. Algo es igual. Ambas son amarillas.,Hier sind zwei Bilder. Etwas ist gleich. Beide sind gelb.,NO APPROVED TRANSLATION,,,NO APPROVED TRANSLATION,,
same-different-selection-highlight-1,same-different-selection,Is it this one?,,NO APPROVED TRANSLATION,NO APPROVED TRANSLATION,NO APPROVED TRANSLATION,,,NO APPROVED TRANSLATION,,
same-different-selection-highlight-2,same-different-selection,Or this one?,,NO APPROVED TRANSLATION,NO APPROVED TRANSLATION,NO APPROVED TRANSLATION,,,NO APPROVED TRANSLATION,,
same-different-selection-instruct-1,same-different-selection,"This is the matching game. In this game, you're going to choose sets of cards that match in some way. First, let's look at some of the cards you are going to see.",,NO APPROVED TRANSLATION,NO APPROVED TRANSLATION,NO APPROVED TRANSLATION,,,NO APPROVED TRANSLATION,,
same-different-selection-instruct1,same-different-selection,"This is the matching game. In this game, you're going to choose sets of cards that match in some way. First, let's look at some of the cards you are going to see.","Este es el juego de las parejas. En este juego, vas a elegir conjuntos de cartas que se parecen de alguna manera. Primero, veamos algunas de las cartas que vas a ver.",NO APPROVED TRANSLATION,NO APPROVED TRANSLATION,NO APPROVED TRANSLATION,"This is the matching game. In this game, you're going to choose sets of cards that match in some way. First, let's look at some of the cards you are going to see.","Ĉi tio estas la kongrua ludo. En ĉi tiu ludo, vi elektos arojn da kartoj kiuj kongruas iel. Unue, ni rigardu iujn el la kartoj kiujn vi vidos.",NO APPROVED TRANSLATION,Dit is het koppelspel. In dit spel ga je sets kaarten kiezen die op een bepaalde manier bij elkaar passen. Laten we eerst eens kijken naar een aantal kaarten die je gaat zien.,
same-different-selection-instruct1-heavy,same-different-selection,"This is the matching game. In this game, we are going to look at pictures and find things about them that are the same in some way.",,"Este es el juego de emparejar. En este juego, vamos a mirar imágenes y encontrar cosas que sean iguales de alguna manera.","Das ist das Zuordnungsspiel. In diesem Spiel werden wir uns Bilder anschauen und Dinge finden, die auf irgendeine Weise gleich sind.",NO APPROVED TRANSLATION,,,NO APPROVED TRANSLATION,,
same-different-selection-instruct2,same-different-selection,Now you're going to see two cards that are the same in one way. Then you will see a new card that is similar to one of those cards. Your job is to choose the card that is similar to the new card.,,Ahora vas a ver dos cartas que son iguales de alguna manera. Luego vas a ver una nueva carta que se parece a una de esas cartas. Tu trabajo es elegir la carta que se parece en algo a esa nueva carta.,"Jetzt siehst du zwei Karten, die in einer Hinsicht gleich sind. Dann siehst du eine neue Karte, die einer der ersten beiden Karten ähnlich ist. Deine Aufgabe ist es, die Karte zu wählen, die der neuen Karte ähnlich ist.",NO APPROVED TRANSLATION,,,NO APPROVED TRANSLATION,,
same-different-selection-instruct2-heavy,same-different-selection,Now we're going to look at more pictures and find things about them that are the same. Let's learn how to play!,,Ahora vamos a ver más imágenes y encontrar cosas que sean iguales. ¡Vamos a aprender a jugar!,"Jetzt schauen wir uns mehr Bilder an und finden Dinge heraus, die gleich sind. Lass uns lernen, wie man spielt!",NO APPROVED TRANSLATION,,,NO APPROVED TRANSLATION,,
same-different-selection-instruct3,same-different-selection,"Now you're going to see three cards, and you're going to choose two that are the same in some way. Then you're going to see the same cards again, and pick two cards that are the same in a different way.",,"Ahora vas a ver tres cartas y debes escoger dos que sean iguales de alguna manera. Luego vas a ver las mismas tres cartas, pero  vas a escoger otras dos cartas que sean iguales de alguna otra manera.","Jetzt siehst du drei Karten und wählst zwei aus, die auf irgendeine Weise gleich sind. Dann siehst du dieselben Karten noch einmal und wählst zwei Karten aus, die auf eine andere Weise gleich sind.",NO APPROVED TRANSLATION,,,NO APPROVED TRANSLATION,,
same-different-selection-instruct3-heavy,same-different-selection,Now you're going to play the rest of the game on your own!,,¡Ahora vas a jugar el resto del juego por tu cuenta!,Jetzt wirst du den Rest des Spiels alleine spielen!,NO APPROVED TRANSLATION,,,NO APPROVED TRANSLATION,,
same-different-selection-instruct3-v2,same-different-selection,"Now you're going to see three cards, and your job is to make two matches.","Ahora vas a ver tres cartas, y tu tarea es formar dos parejas.",NO APPROVED TRANSLATION,NO APPROVED TRANSLATION,NO APPROVED TRANSLATION,"Now you're going to see three cards, and your job is to make two matches.","Nun vi vidos tri kartojn, kaj via tasko estas fari du parojn.",NO APPROVED TRANSLATION,"Je krijgt nu drie kaarten te zien, en het is jouw taak om er twee te koppelen.",
same-different-selection-instruct4,same-different-selection,"Now you're going to see four cards, and your job is to find two cards that are the same to make a match.","Ahora vas a ver cuatro cartas, y tu tarea es encontrar dos cartas que sean iguales para formar una pareja.",NO APPROVED TRANSLATION,NO APPROVED TRANSLATION,NO APPROVED TRANSLATION,"Now you're going to see four cards, and your job is to find two cards that are the same to make a match.","Nun vi vidos kvar kartojn, kaj via tasko estas trovi du kartojn kiuj estas samaj por fari paron.",NO APPROVED TRANSLATION,Je ziet nu vier kaarten en het is jouw taak om twee kaarten die hetzelfde zijn te vinden om een koppel te maken.,
same-different-selection-instruct4-heavy,same-different-selection,Now we're going to try something new! You're going to find pairs of shapes that are the same in some way. Let's learn how!,,¡Ahora vamos a intentar algo nuevo! Vas a encontrar pares de formas que sean iguales de alguna manera. ¡Vamos a aprender cómo!,"Jetzt werden wir etwas Neues ausprobieren! Du wirst Paare von Formen finden, die auf irgendeine Weise gleich sind. Lass uns lernen, wie das geht!",NO APPROVED TRANSLATION,,,NO APPROVED TRANSLATION,,
same-different-selection-instruct5,same-different-selection,"Now you're going to see five cards, and your job is to make four matches.","Ahora vas a ver cinco cartas, y tu tarea es formar cuatro parejas.",NO APPROVED TRANSLATION,NO APPROVED TRANSLATION,NO APPROVED TRANSLATION,"Now you're going to see five cards, and your job is to make four matches.","Nun vi vidos kvin kartojn, kaj via tasko estas krei kvar parojn.",NO APPROVED TRANSLATION,"Je krijgt nu vijf kaarten te zien, en het is jouw taak om vier koppels te maken.",
same-different-selection-instruct5-heavy,same-different-selection,Here are three pictures. I have to choose 2 of them that are the same in some way. I will pick these 2 pictures because they are both triangles.,,Aquí hay tres imágenes. Tengo que elegir 2 de ellas que sean iguales de alguna manera. Voy a escoger estas 2 imágenes porque ambas son triángulos.,"Hier sind drei Bilder. Ich muss zwei davon auswählen, die auf irgendeine Weise gleich sind. Ich wähle diese beiden Bilder, weil sie beide Dreiecke sind.",NO APPROVED TRANSLATION,,,NO APPROVED TRANSLATION,,
same-different-selection-instruct6-heavy,same-different-selection,Here are the same three pictures. I have to choose 2 of them that are the same in a different way. I will pick these 2 pictures because they are both red.,,Aquí están las mismas tres imágenes. Tengo que elegir 2 de ellas que sean iguales de otra manera. Voy a escoger estas 2 imágenes porque ambas son rojas.,"Hier sind dieselben drei Bilder. Ich muss zwei davon auswählen, die auf eine andere Weise gleich sind. Ich wähle diese beiden Bilder, weil sie beide rot sind.",NO APPROVED TRANSLATION,,,NO APPROVED TRANSLATION,,
same-different-selection-new-card,same-different-selection,Here is a new card.,Aquí hay una nueva carta.,NO APPROVED TRANSLATION,NO APPROVED TRANSLATION,NO APPROVED TRANSLATION,Here is a new card.,Jen nova karto.,NO APPROVED TRANSLATION,Hier is een nieuwe kaart.,
same-different-selection-prompt3-v2,same-different-selection,The new card is the same as one of these two cards. Choose the one that is the same as the new card to make a match.,La nueva carta es igual a una de estas dos cartas. Elegí la que es igual a la carta nueva para formar una pareja.,NO APPROVED TRANSLATION,NO APPROVED TRANSLATION,NO APPROVED TRANSLATION,The new card is the same as one of these two cards. Choose the one that is the same as the new card to make a match.,La nova karto estas sama kiel unu el tiuj du kartoj. Elektu tiun kiu estas sama kiel la nova karto por fari paron.,NO APPROVED TRANSLATION,De nieuwe kaart is hetzelfde als een van deze twee kaarten. Kies de kaart die hetzelfde is als de nieuwe kaart om een koppel te maken.,
same-different-selection-touch-1,same-different-selection,Choose the card with one star.,Elegí la carta con una estrella.,NO APPROVED TRANSLATION,NO APPROVED TRANSLATION,NO APPROVED TRANSLATION,Choose the card with one star.,Elektu la karton kun unu stelo.,NO APPROVED TRANSLATION,Kies de kaart met 1 ster.,
same-different-selection-touch-1-heavy,same-different-selection,Show me the picture with one shape.,,Muéstrame la imagen con una forma.,Zeige mir das Bild mit einer Form.,NO APPROVED TRANSLATION,,,NO APPROVED TRANSLATION,,
same-different-selection-touch-2,same-different-selection,Choose the card with 2 stars.,,Escoge la carta con 2 estrellas.,Wähle die Karte mit zwei Sternen.,NO APPROVED TRANSLATION,,,NO APPROVED TRANSLATION,,
same-different-selection-touch-2-heavy,same-different-selection,Show me the picture with two shapes.,,Muéstrame la imagen con dos formas.,Zeige mir das Bild mit zwei Formen.,NO APPROVED TRANSLATION,,,NO APPROVED TRANSLATION,,
same-different-selection-touch-2-v2,same-different-selection,Choose the card with two triangles.,Elegí la carta con dos triángulos.,NO APPROVED TRANSLATION,NO APPROVED TRANSLATION,NO APPROVED TRANSLATION,Choose the card with two triangles.,Elektu la karton kun du trianguloj.,NO APPROVED TRANSLATION,Kies de kaart met twee driehoeken.,
same-different-selection-touch-3,same-different-selection,Choose the card with 3 stars.,,Escoge la carta con 3 estrellas.,Wähle die Karte mit drei Sternen.,NO APPROVED TRANSLATION,,,NO APPROVED TRANSLATION,,
same-different-selection-touch-3-heavy,same-different-selection,Show me the picture with three shapes.,,Muéstrame la imagen con tres formas.,Zeige mir das Bild mit drei Formen.,NO APPROVED TRANSLATION,,,NO APPROVED TRANSLATION,,
same-different-selection-touch-3-v2,same-different-selection,Choose the card with three circles.,Elegí la carta con tres círculos.,NO APPROVED TRANSLATION,NO APPROVED TRANSLATION,NO APPROVED TRANSLATION,Choose the card with three circles.,Elektu la karton kun tri cirkloj.,NO APPROVED TRANSLATION,Kies de kaart met drie cirkels.,
same-different-selection-touch-4,same-different-selection,Choose the card with 4 stars.,,Escoge la carta con 4 estrellas.,Wähle die Karte mit vier Sternen.,NO APPROVED TRANSLATION,,,NO APPROVED TRANSLATION,,
same-different-selection-touch-4-heavy,same-different-selection,Show me the picture with four shapes.,,Muéstrame la imagen con cuatro formas.,Zeige mir das Bild mit vier Formen.,NO APPROVED TRANSLATION,,,NO APPROVED TRANSLATION,,
same-different-selection-touch-4-v2,same-different-selection,Choose the card with four squares.,Elegí la carta con cuatro cuadrados.,NO APPROVED TRANSLATION,NO APPROVED TRANSLATION,NO APPROVED TRANSLATION,Choose the card with four squares.,Elektu la karton kun kvar kvadratoj.,NO APPROVED TRANSLATION,Kies de kaart met vier vierkanten.,
same-different-selection-touch-black,same-different-selection,Choose the star on the black card.,,Escoge la estrella en la carta negra.,Wähle den Stern auf der schwarzen Karte.,NO APPROVED TRANSLATION,,,NO APPROVED TRANSLATION,,
same-different-selection-touch-black-heavy,same-different-selection,Show me the picture with the black background.,,Muéstrame la imagen con el fondo negro.,Zeige mir das Bild mit dem schwarzen Hintergrund.,NO APPROVED TRANSLATION,,,NO APPROVED TRANSLATION,,
same-different-selection-touch-black-v2,same-different-selection,Choose the black card.,Elegí la carta negra.,NO APPROVED TRANSLATION,NO APPROVED TRANSLATION,NO APPROVED TRANSLATION,Choose the black card.,Elektu la nigran karton.,NO APPROVED TRANSLATION,Kies de zwarte kaart.,
same-different-selection-touch-blue,same-different-selection,Choose the card with a blue shape.,,Escoge la carta que tiene una figura azul.,Wähle die Karte mit einer blauen Form.,NO APPROVED TRANSLATION,,,NO APPROVED TRANSLATION,,
same-different-selection-touch-blue-heavy,same-different-selection,Show me the blue one.,,Muéstrame el azul.,Zeige mir das blaue.,NO APPROVED TRANSLATION,,,NO APPROVED TRANSLATION,,
same-different-selection-touch-blue-v2,same-different-selection,Choose the blue one.,Elegí la azul.,NO APPROVED TRANSLATION,NO APPROVED TRANSLATION,NO APPROVED TRANSLATION,Choose the blue one.,Elektu la bluon.,NO APPROVED TRANSLATION,Kies de blauwe.,
same-different-selection-touch-circle,same-different-selection,Choose the card with a circle.,,Escoge la carta que tiene un círculo.,Wähle die Karte mit einem Kreis.,NO APPROVED TRANSLATION,,,NO APPROVED TRANSLATION,,
same-different-selection-touch-circle-heavy,same-different-selection,Show me the circle.,,Muéstrame el círculo.,Zeige mir den Kreis.,NO APPROVED TRANSLATION,,,NO APPROVED TRANSLATION,,
same-different-selection-touch-circle-v2,same-different-selection,Choose the circle.,Elegí el círculo.,NO APPROVED TRANSLATION,NO APPROVED TRANSLATION,NO APPROVED TRANSLATION,Choose the circle.,Elektu la cirklon.,NO APPROVED TRANSLATION,Kies de cirkel.,
same-different-selection-touch-gray,same-different-selection,Choose the star on the gray card.,,Escoge la estrella en la carta gris.,Wähle den Stern auf der grauen Karte.,NO APPROVED TRANSLATION,,,NO APPROVED TRANSLATION,,
same-different-selection-touch-gray-heavy,same-different-selection,Show me the picture with the gray background.,,Muéstrame la imagen con el fondo gris.,Zeige mir das Bild mit dem grauen Hintergrund.,NO APPROVED TRANSLATION,,,NO APPROVED TRANSLATION,,
same-different-selection-touch-gray-v2,same-different-selection,Choose the gray card.,Elegí la carta gris.,NO APPROVED TRANSLATION,NO APPROVED TRANSLATION,NO APPROVED TRANSLATION,Choose the grey card.,Elektu la grizan karton.,NO APPROVED TRANSLATION,Kies de grijze kaart.,
same-different-selection-touch-green,same-different-selection,Choose the card with a green shape.,,Escoge la carta que tiene una figura verde.,Wähle die Karte mit einer grünen Form.,NO APPROVED TRANSLATION,,,NO APPROVED TRANSLATION,,
same-different-selection-touch-green-heavy,same-different-selection,Show me the green one.,,Muéstrame el verde.,Zeige mir das grüne.,NO APPROVED TRANSLATION,,,NO APPROVED TRANSLATION,,
same-different-selection-touch-green-v2,same-different-selection,Choose the green one.,Elegí la verde.,NO APPROVED TRANSLATION,NO APPROVED TRANSLATION,NO APPROVED TRANSLATION,Choose the green one.,Elektu la veran.,NO APPROVED TRANSLATION,Kies de groene.,
same-different-selection-touch-large,same-different-selection,Choose the card with a large shape.,,Escoge la carta que tiene una figura grande.,Wähle die Karte mit einer großen Form.,NO APPROVED TRANSLATION,,,NO APPROVED TRANSLATION,,
same-different-selection-touch-large-heavy,same-different-selection,Show me the large one.,,Muéstrame el grande.,Zeige mir das große.,NO APPROVED TRANSLATION,,,NO APPROVED TRANSLATION,,
same-different-selection-touch-large-v2,same-different-selection,Choose the big one.,Elegí la grande.,NO APPROVED TRANSLATION,NO APPROVED TRANSLATION,NO APPROVED TRANSLATION,Choose the big one.,Elektu la grandan.,NO APPROVED TRANSLATION,Kies de grote.,
same-different-selection-touch-medium,same-different-selection,Choose the card with a medium-sized shape.,,Escoge la carta que tiene una figura mediana.,Wähle die Karte mit einer mittelgroßen Form.,NO APPROVED TRANSLATION,,,NO APPROVED TRANSLATION,,
same-different-selection-touch-medium-heavy,same-different-selection,Show me the medium one.,,Muéstrame el mediano.,Zeige mir das mittelgroße.,NO APPROVED TRANSLATION,,,NO APPROVED TRANSLATION,,
same-different-selection-touch-medium-v2,same-different-selection,Choose the medium one.,Elegí la mediana.,NO APPROVED TRANSLATION,NO APPROVED TRANSLATION,NO APPROVED TRANSLATION,Choose the medium one.,Elektu la mezan.,NO APPROVED TRANSLATION,Kies de middelgrote.,
same-different-selection-touch-red,same-different-selection,Choose the card with a red shape.,,Escoge la carta que tiene una figura roja.,Wähle die Karte mit einer roten Form.,NO APPROVED TRANSLATION,,,NO APPROVED TRANSLATION,,
same-different-selection-touch-red-heavy,same-different-selection,Show me the red one.,,Muéstrame el rojo.,Zeige mir das rote.,NO APPROVED TRANSLATION,,,NO APPROVED TRANSLATION,,
same-different-selection-touch-red-v2,same-different-selection,Choose the red one.,Elegí la roja.,NO APPROVED TRANSLATION,NO APPROVED TRANSLATION,NO APPROVED TRANSLATION,Choose the red one.,Elektu la ruĝan.,NO APPROVED TRANSLATION,Kies de rode.,
same-different-selection-touch-small,same-different-selection,Choose the card with a small shape.,,Escoge la carta que tiene una figura pequeña.,Wähle die Karte mit einer kleinen Form.,NO APPROVED TRANSLATION,,,NO APPROVED TRANSLATION,,
same-different-selection-touch-small-heavy,same-different-selection,Show me the small one.,,Muéstrame el pequeño.,Zeige mir das kleine.,NO APPROVED TRANSLATION,,,NO APPROVED TRANSLATION,,
same-different-selection-touch-small-v2,same-different-selection,Choose the small one.,Elegí la pequeña.,NO APPROVED TRANSLATION,NO APPROVED TRANSLATION,NO APPROVED TRANSLATION,Choose the small one.,Elektu la malgrandan.,NO APPROVED TRANSLATION,Kies de kleine.,
same-different-selection-touch-square,same-different-selection,Choose the card with a square.,,Escoge la carta que tiene un cuadrado.,Wähle die Karte mit einem Quadrat.,NO APPROVED TRANSLATION,,,NO APPROVED TRANSLATION,,
same-different-selection-touch-square-heavy,same-different-selection,Show me the square.,,Muéstrame el cuadrado.,Zeige mir das Quadrat.,NO APPROVED TRANSLATION,,,NO APPROVED TRANSLATION,,
same-different-selection-touch-square-v2,same-different-selection,Choose the square.,Elegí el cuadrado.,NO APPROVED TRANSLATION,NO APPROVED TRANSLATION,NO APPROVED TRANSLATION,Choose the square.,Elektu la kvadraton.,NO APPROVED TRANSLATION,Kies het vierkant.,
same-different-selection-touch-star,same-different-selection,Choose the card with a star.,,Escoge la carta que tiene una estrella.,Wähle die Karte mit einem Stern.,NO APPROVED TRANSLATION,,,NO APPROVED TRANSLATION,,
same-different-selection-touch-star-heavy,same-different-selection,Show me the star.,,Muéstrame la estrella.,Zeige mir den Stern.,NO APPROVED TRANSLATION,,,NO APPROVED TRANSLATION,,
same-different-selection-touch-star-v2,same-different-selection,Choose the star.,Elegí la estrella.,NO APPROVED TRANSLATION,NO APPROVED TRANSLATION,NO APPROVED TRANSLATION,Choose the star.,Elektu la stelon.,NO APPROVED TRANSLATION,Kies de ster.,
same-different-selection-touch-striped,same-different-selection,Choose the star on the striped card.,,Escoge la estrella en la carta con rayas.,Wähle den Stern auf der gestreiften Karte.,NO APPROVED TRANSLATION,,,NO APPROVED TRANSLATION,,
same-different-selection-touch-striped-heavy,same-different-selection,Show me the picture with the striped background.,,Muéstrame la imagen con el fondo a rayas.,Zeige mir das Bild mit dem gestreiften Hintergrund.,NO APPROVED TRANSLATION,,,NO APPROVED TRANSLATION,,
same-different-selection-touch-striped-v2,same-different-selection,Choose the striped card.,Elegí la carta con rayas.,NO APPROVED TRANSLATION,NO APPROVED TRANSLATION,NO APPROVED TRANSLATION,Choose the striped card.,Elektu la strioforma karton.,NO APPROVED TRANSLATION,Kies de gestreepte kaart.,
same-different-selection-touch-triangle,same-different-selection,Choose the card with a triangle.,,Escoge la carta que tiene un triángulo.,Wähle die Karte mit einem Dreieck.,NO APPROVED TRANSLATION,,,NO APPROVED TRANSLATION,,
same-different-selection-touch-triangle-heavy,same-different-selection,Show me the triangle.,,Muéstrame el triángulo.,Zeige mir das Dreieck.,NO APPROVED TRANSLATION,,,NO APPROVED TRANSLATION,,
same-different-selection-touch-triangle-v2,same-different-selection,Choose the triangle.,Elegí el triángulo.,NO APPROVED TRANSLATION,NO APPROVED TRANSLATION,NO APPROVED TRANSLATION,Choose the triangle.,Elektu la triangulon.,NO APPROVED TRANSLATION,Kies de driehoek.,
same-different-selection-touch-white,same-different-selection,Choose the star on the white card.,,Escoge la estrella en la carta blanca.,Wähle den Stern auf der weißen Karte.,NO APPROVED TRANSLATION,,,NO APPROVED TRANSLATION,,
same-different-selection-touch-white-heavy,same-different-selection,Show me the picture with the white background.,,Muéstrame la imagen con el fondo blanco.,Zeige mir das Bild mit dem weißen Hintergrund.,NO APPROVED TRANSLATION,,,NO APPROVED TRANSLATION,,
same-different-selection-touch-white-v2,same-different-selection,Choose the white card.,Elegí la carta blanca.,NO APPROVED TRANSLATION,NO APPROVED TRANSLATION,NO APPROVED TRANSLATION,Choose the white card.,Elektu la blankan karton.,NO APPROVED TRANSLATION,Kies de witte kaart.,
same-different-selection-touch-yellow,same-different-selection,Choose the card with a yellow shape.,,Escoge la carta que tiene una figura amarilla.,Wähle die Karte mit einer gelben Form.,NO APPROVED TRANSLATION,,,NO APPROVED TRANSLATION,,
same-different-selection-touch-yellow-heavy,same-different-selection,Show me the yellow one.,,Muéstrame el amarillo.,Zeige mir das gelbe.,NO APPROVED TRANSLATION,,,NO APPROVED TRANSLATION,,
same-different-selection-touch-yellow-v2,same-different-selection,Choose the yellow one.,Elegí la amarilla.,NO APPROVED TRANSLATION,NO APPROVED TRANSLATION,NO APPROVED TRANSLATION,Choose the yellow one.,Elektu la flavon.,NO APPROVED TRANSLATION,Kies de gele.,
scared,theory-of-mind,scared,asustado,asustado,ängstlich,NO APPROVED TRANSLATION,,timigita,NO APPROVED TRANSLATION,bang,
scared-fem,theory-of-mind,scared,asustada,,,,,timigita,,bang[VROUW],
scared-plural,theory-of-mind,scared,asustados,,,,,timigita[PLURAL],,bang[MEERVOUD],
sds-2match-prompt1,same-different-selection,Here is a new set of cards. Choose two cards that are the same in some way.,,Aquí hay un nuevo grupo de cartas. Escoge dos cartas que sean iguales en algún aspecto.,"Hier sind neue Karten. Wähle zwei Karten aus, die in irgendeiner Weise gleich sind.",NO APPROVED TRANSLATION,,,NO APPROVED TRANSLATION,,
sds-2match-prompt1-heavy,same-different-selection,Here are some new pictures. Choose two of them that are the same in some way.,,Aquí hay algunas imágenes nuevas. Elige dos de ellas que sean iguales de alguna manera.,"Hier sind einige neue Bilder. Wählen Sie zwei davon aus, die in irgendeiner Weise gleich sind.",NO APPROVED TRANSLATION,,,NO APPROVED TRANSLATION,,
sds-2match-prompt2,same-different-selection,Choose two cards that are the same in a different way.,,Escoge dos cartas que sean pareja porque son iguales en algo diferente.,"Wähle zwei Karten, die auf unterschiedliche Weise gleich sind.",NO APPROVED TRANSLATION,,,NO APPROVED TRANSLATION,,
sds-2match-prompt2-heavy,same-different-selection,Now choose two pictures that are the same in a different way.,,Ahora elige dos imágenes que sean iguales de otro modo.,"Jetzt wähle zwei Bilder aus, die auf eine andere Weise gleich sind.",NO APPROVED TRANSLATION,,,NO APPROVED TRANSLATION,,
