item_id,task,en-US,es-AR,es-CO,de-DE,ar-IL,en-GB,eo-UY,he-IL,nl-NL,pt-BR
hearts-and-flowers-instruct-keyboard,hearts-and-flowers,Looks like you have a keyboard! Let's learn how to use your keyboard to play this game.,¡Parece que tenés un teclado! Aprendamos a usar el teclado para jugar este juego.,NO APPROVED TRANSLATION,NO APPROVED TRANSLATION,NO APPROVED TRANSLATION,Looks like you have a keyboard! Let's learn how to use your keyboard to play this game.,Ŝajnas ke vi havas klavaron! Ni lernu kiel uzi vian klavaron por ludi ĉi tiun ludon.,NO APPROVED TRANSLATION,Het lijkt erop dat je een toetsenbord hebt! Laten we leren hoe je je toetsenbord kunt gebruiken om dit spel te spelen.,
hearts-and-flowers-instruct-touchscreen,hearts-and-flowers,Looks like you have a touch screen! Let's learn how to use your touch screen to play this game.,¡Parece que tenés una pantalla táctil! Aprendamos a usar la pantalla táctil para jugar este juego.,NO APPROVED TRANSLATION,NO APPROVED TRANSLATION,NO APPROVED TRANSLATION,Looks like you have a touch screen! Let's learn how to use your touch screen to play this game.,Ŝajnas ke vi havas tuŝekranon! Ni lernu kiel uzi vian tuŝekranon por ludi ĉi tiun ludon.,NO APPROVED TRANSLATION,Het lijkt erop dat je een touchscreen hebt! Laten we leren hoe je je touchscreen kunt gebruiken om dit spel te spelen.,
hearts-and-flowers-instruct1,hearts-and-flowers,This time the game will go faster. It won't tell you if you are right or wrong. Try to keep up!,Esta vez el juego irá más rápido. No te dirá si la respuesta es correcta o no. ¡Tratá de seguir el ritmo!,Esta vez el juego irá más rápido. No te dirá si la respuesta es correcta o no. ¡Trata de seguir el ritmo!,"Jetzt spielen wir das Spiel schneller. Dir wird nicht gesagt, ob du richtig oder falsch liegst. Versuch hinterherzukommen!",NO APPROVED TRANSLATION,This time the game will go faster. It won't tell you if you are right or wrong. Try to keep up!,Ĉi-foje la ludo iros pli rapide. Ĝi ne diros al vi ĉu vi pravas aŭ malpravas. Provu resti ĉe la nivelo!,NO APPROVED TRANSLATION,Deze keer gaat het spel sneller. Het laat je niet weten of je goed of fout zit. Probeer bij te blijven!,
hearts-and-flowers-instruct2,hearts-and-flowers,"Try to answer as fast as you can without making mistakes. If you make a mistake, just keep going!","Intentá responder lo más rápido que puedas sin cometer errores. Si cometés un error, ¡seguí adelante!","Intenta responder lo más rápido que puedas sin cometer errores. Si cometes un error, ¡sigue adelante!","Versuche, so schnell wie möglich zu antworten, ohne Fehler zu machen. Wenn du einen Fehler machst, mach einfach weiter!",NO APPROVED TRANSLATION,"Try to answer as fast as you can without making mistakes. If you make a mistake, just keep going!","Provu respondi kiel eble plej rapide sen fari erarojn. Se vi faras eraron, simple daŭrigu!",NO APPROVED TRANSLATION,"Probeer zo snel mogelijk te antwoorden zonder fouten te maken. Als je een fout maakt, ga dan gewoon door!",
hearts-and-flowers-instruct3,hearts-and-flowers,"Now, we're going to play a game with hearts and flowers.","Ahora, vamos a jugar un juego con corazones y flores.","Ahora, vamos a jugar un juego con corazones y flores.",Jetzt werden wir ein Spiel mit Herzen und Blumen spielen.,NO APPROVED TRANSLATION,"Now, we're going to play a game with hearts and flowers.",Nun ni ludos ludon kun koroj kaj floroj.,NO APPROVED TRANSLATION,Nu gaan we een spelletje doen met hartjes en bloemen.,
hearts-and-flowers-instruct4,hearts-and-flowers,This time the game will go even faster. Try to keep up!,Esta vez el juego irá todavía más rápido. ¡Tratá de seguir el ritmo!,NO APPROVED TRANSLATION,NO APPROVED TRANSLATION,NO APPROVED TRANSLATION,This time the game will go even faster. Try to keep up!,Ĉi-foje la ludo estos eĉ pli rapida. Provu resti ĉe la nivelo!,NO APPROVED TRANSLATION,Deze keer zal het spel nog sneller gaan. Probeer het bij te houden!,
hearts-and-flowers-play-time,general,Time to play!,¡Hora de jugar!,¡Hora de jugar!,Jetzt geht das Spiel richtig los!,NO APPROVED TRANSLATION,,Tempo por ludi!,NO APPROVED TRANSLATION,,
hearts-and-flowers-practice-time,hearts-and-flowers,Time to practice!,¡Es hora de practicar!,¡Es hora de practicar!,Jetzt kannst du üben!,NO APPROVED TRANSLATION,Time to practice!,Estas tempo por ekzerci!,NO APPROVED TRANSLATION,Tijd om te oefenen!,
hearts-and-flowers-press-any-key,hearts-and-flowers,Press the spacebar to continue.,Presioná la barra espaciadora para continuar.,NO APPROVED TRANSLATION,NO APPROVED TRANSLATION,NO APPROVED TRANSLATION,Press the spacebar to continue.,Premu la spacoklavon por daŭrigi.,NO APPROVED TRANSLATION,Druk op de spatiebalk om verder te gaan.,
hearts-and-flowers-try-again,hearts-and-flowers,That's not quite right. Please try again.,Eso no está del todo bien. ¡Intentalo de nuevo!,Eso no está del todo bien. ¡Inténtalo de nuevo!,Das stimmt nicht ganz. Versuch es noch einmal!,NO APPROVED TRANSLATION,That's not quite right. Please try again.,Tio ne estas tute ĝusta. Bonvolu reprovi.,NO APPROVED TRANSLATION,Dat is niet helemaal juist. Probeer het opnieuw.,
hill,theory-of-mind,A hill,Una montaña,Una montaña,Einen Hügel,NO APPROVED TRANSLATION,,Monteto,NO APPROVED TRANSLATION,Een heuvel,
hillsbook,theory-of-mind,The book about hills,El libro de las montañas,El libro de las montañas,Das Buch über Hügel,NO APPROVED TRANSLATION,,La libro pri montetoj,NO APPROVED TRANSLATION,Het boek over heuvels,
hostile-attribution-scene1-by-accident,hostile-attribution,by accident,por accidente,por accidente,aus Versehen,NO APPROVED TRANSLATION,,hazarde,NO APPROVED TRANSLATION,,
hostile-attribution-scene1-instruct1,hostile-attribution,Imagine that you are walking to school and you’re wearing your new shoes. You really like your new shoes and this is the first day you have worn them.,Imaginá que vas camino a la escuela y llevás puestos tus zapatos nuevos. Te gustan mucho tus zapatos nuevos y es la primera vez que los usás.,NO APPROVED TRANSLATION,"Stell dir vor, du gehst zur Schule und trägst deine neuen Schuhe. Du magst deine neuen Schuhe sehr und heute ist der erste Tag, an dem du sie trägst.",NO APPROVED TRANSLATION,,Imagu ke vi estas piedirante al lernejo kaj vi portas viajn novajn ŝuojn. Vi vere ŝatas viajn novajn ŝuojn kaj ĉi tiu estas la unua tago kiam vi portas ilin.,NO APPROVED TRANSLATION,,
hostile-attribution-scene1-instruct2,hostile-attribution,"Suddenly, you are bumped from behind by a boy. You stumble and fall into a mud puddle and your new shoes get muddy.","De repente, un chico te choca por detrás. Te tropezás y caés en un charco de barro y tus zapatos nuevos se ensucian de barro.","De repente, un chico te choca por detrás. Tropiezas y caes en un charco de barro y tus zapatos nuevos se ensucian de barro",Plötzlich wirst du von einem Jungen von hinten angerempelt. Du stolperst und fällst in eine Schlammpfütze und deine neuen Schuhe sind schlammig.,NO APPROVED TRANSLATION,,"Subite, knabo puŝas vin de malantaŭe. Vi balanciĝas kaj falas en kotan akvujon kaj viaj novaj ŝuoj kotoformas.",NO APPROVED TRANSLATION,,
hostile-attribution-scene1-on-purpose,hostile-attribution,on purpose,a propósito,a propósito,absichtlich,NO APPROVED TRANSLATION,,intence,NO APPROVED TRANSLATION,,
hostile-attribution-scene1-q1,hostile-attribution,Do you think that the boy bumped you on purpose or by accident?,¿Creés que el chico te chocó a propósito o por accidente?,¿Crees que el chico te golpeó a propósito o por accidente?,"Glaubst du, dass der Junge dich absichtlich oder aus Versehen angerempelt hat?",NO APPROVED TRANSLATION,,"Ĉu vi pensas, ke la knabo puŝis vin intence aŭ akcidente?",NO APPROVED TRANSLATION,,
hostile-attribution-scene1-q2,hostile-attribution,Now pick one of the three choices as the one you would do:,Ahora elegí cuál de estas tres opciones harías vos:,Ahora escoge cuál de estas tres opciones harías tú:,Was würdest du tun? Wähle eine der drei Möglichkeiten aus.,NO APPROVED TRANSLATION,,Nun elektu unu el la tri ebloj kiel la unu kiun vi farus:,NO APPROVED TRANSLATION,,
hostile-attribution-scene1-q2-ans1,hostile-attribution,clean up my shoes,limpiar mis zapatos,limpiar mis zapatos,meine Schuhe sauber machen,NO APPROVED TRANSLATION,,purigi miajn ŝuojn,NO APPROVED TRANSLATION,,
hostile-attribution-scene1-q2-ans2,hostile-attribution,walk away from the boy,alejarme del chico,alejarme del chico,sich von dem Jungen entfernen,NO APPROVED TRANSLATION,,foriri de la knabo,NO APPROVED TRANSLATION,,
hostile-attribution-scene1-q2-ans3,hostile-attribution,push the boy in the mud,empujar al chico al barro,empujar al chico al barro,den Jungen in den Schlamm stoßen,NO APPROVED TRANSLATION,,puŝi la knabon en la koto,NO APPROVED TRANSLATION,,
hostile-attribution-scene2-by-accident,hostile-attribution,by accident,por accidente,por accidente,aus Versehen,NO APPROVED TRANSLATION,,hazarde,NO APPROVED TRANSLATION,,
hostile-attribution-scene2-instruct1,hostile-attribution,"Imagine that you are on the playground. You and some other kids are having a race. A boy is standing on the side, bouncing a basketball.","Imaginá que estás en el patio de recreo. Vos y otros niños están haciendo una carrera. Un niño está parado a un lado, haciendo rebotar una pelota de básquet.","Imagina que estás en el patio de recreo. Tú y otros niños están haciendo una carrera. Un niño está parado a un lado, haciendo rebotar una pelota de baloncesto.","Stell dir vor, du bist auf einem Spielplatz. Du und einige andere Kinder rennen um die Wette. Ein Junge steht am Rand und spielt mit einem Basketball.",NO APPROVED TRANSLATION,,"Imagu ke vi estas sur la ludkampo. Vi kaj kelkaj aliaj infanoj faras vetkuron. Kna homo staras flanke, resaltante basbalon.",NO APPROVED TRANSLATION,,
hostile-attribution-scene2-instruct2,hostile-attribution,"The next thing you know, the boy has bounced the ball and it has rolled under your feet, making you fall. You skin your knee and someone else wins the race.","De repente, el chico hace rebotar la pelota y rueda bajo tus pies, haciéndote caer. Te raspás la rodilla, y alguien más gana la carrera.","De repente, el chico hace rebotar la pelota y rueda bajo tus pies, haciéndote caer. Te raspas la rodilla, y alguien más gana la carrera.",Dann rollt der Ball von dem Jungen unter deine Füße und du fällst hin. Du schürfst dir das Knie auf und ein anderer gewinnt das Rennen.,NO APPROVED TRANSLATION,,"La sekva afero, kiun vi scias, estas ke la knabo resaltis la pilkon kaj ĝi ruliĝis sub viajn piedojn, igante vin fali. Vi ektetas vian genuon kaj alia homo gajnas la vetkuron.",NO APPROVED TRANSLATION,,
hostile-attribution-scene2-on-purpose,hostile-attribution,on purpose,a propósito,a propósito,absichtlich,NO APPROVED TRANSLATION,,intence,NO APPROVED TRANSLATION,,
hostile-attribution-scene2-q1,hostile-attribution,Do you think that the boy made you fall on purpose or by accident?,¿Creés que el chico te hizo caer a propósito o por accidente?,¿Crees que el chico te hizo caer a propósito o por accidente?,"Glaubst du, dass der Junge dich mit Absicht oder aus Versehen zu Boden gestoßen hat?",NO APPROVED TRANSLATION,,"Ĉu vi pensas, ke la knabo igis vin fali intence aŭ akcidente?",NO APPROVED TRANSLATION,,
hostile-attribution-scene2-q2,hostile-attribution,Now pick one of the three choices as the one you would do:,Ahora elegí cuál de estas tres opciones harías vos:,Ahora escoge cuál de estas tres opciones harías tú:,Was würdest du tun? Wähle eine der drei Möglichkeiten aus.,NO APPROVED TRANSLATION,,Nun elektu unu el la tri ebloj kiel la unu kiun vi farus:,NO APPROVED TRANSLATION,,
hostile-attribution-scene2-q2-ans1,hostile-attribution,go to another area of the playground,ir a otra zona del patio de recreo,ir a otra zona del patio de recreo,in einen anderen Bereich des Spielplatzes gehen,NO APPROVED TRANSLATION,,iri al alia areo de la ludkampo,NO APPROVED TRANSLATION,,
hostile-attribution-scene2-q2-ans2,hostile-attribution,say something mean to him,insultar al niño,insultar al niño,etwas Gemeines zu ihm sagen,NO APPROVED TRANSLATION,,diri ion malbonan al li,NO APPROVED TRANSLATION,,
hostile-attribution-scene2-q2-ans3,hostile-attribution,take care of my knee,curar mi rodilla,curar mi rodilla,Mein Knie verarzten.,NO APPROVED TRANSLATION,,zorgi pri mia genuo,NO APPROVED TRANSLATION,,
hostile-attribution-scene3-by-accident,hostile-attribution,by accident,por accidente,por accidente,aus Versehen,NO APPROVED TRANSLATION,,hazarde,NO APPROVED TRANSLATION,,
hostile-attribution-scene3-instruct1,hostile-attribution,Imagine that you are working on an assignment at your desk.,Imaginá que estás trabajando en una tarea en tu escritorio.,Imagina que estás trabajando en una tarea en tu escritorio.,"Stell dir vor, du arbeitest an deinem Schreibtisch an einer Aufgabe.",NO APPROVED TRANSLATION,,Imagu ke vi laboras pri tasko ĉe via skribotablo.,NO APPROVED TRANSLATION,,
hostile-attribution-scene3-instruct2,hostile-attribution,"You go to sharpen your pencil, and as you walk back to your desk there is a boy walking just in front of you. The boy passes your desk before you get there.","Te levantás para sacarle punta a tu lápiz y, de regreso a tu escritorio, vas detrás de un niño que camina justo delante de vos. El niño pasa por tu escritorio antes de que vos llegues.","Te levantas para sacarle punta a tu lápiz y, de regreso a tu escritorio, vas detrás de un niño que camina justo delante de ti. El niño pasa por tu escritorio antes de que tú llegues.","Du gehst deinen Bleistift anspitzen, und als du zu deinem Schreibtisch zurückgehst, läuft ein Junge direkt vor dir. Der Junge geht an deinem Schreibtisch vorbei, bevor du selbst dort bist.",NO APPROVED TRANSLATION,,"Vi iras akrigi vian krajonon, kaj dum vi marŝas reen al via skribotablo estas knabo piediranta ĝuste antaŭ vi. La knabo pasas vian skribotablon antaŭ ol vi alvenas tien.",NO APPROVED TRANSLATION,,
hostile-attribution-scene3-instruct3,hostile-attribution,"The next thing you know, the boy has knocked all of your papers off of your desk, and they are all over the floor.","De repente, el chico tira todos los papeles que estaban en tu escritorio y ahora están regados en el suelo.","De repente, el chico tira todos los papeles que estaban en tu escritorio y ahora están regados en el suelo.","Das nächste ist, dass der Junge alle deine Papiere von deinem Schreibtisch geworfen hat und sie überall auf dem Boden liegen.",NO APPROVED TRANSLATION,,"La sekva afero, kiun vi scias, estas ke la knabo renversis ĉiujn viajn paperojn de via skribotablo kaj ili estas tra la tuta planko.",NO APPROVED TRANSLATION,,
hostile-attribution-scene3-on-purpose,hostile-attribution,on purpose,a propósito,a propósito,absichtlich,NO APPROVED TRANSLATION,,intence,NO APPROVED TRANSLATION,,
hostile-attribution-scene3-q1,hostile-attribution,Do you think the boy knocked your papers onto the floor on purpose or by accident?,¿Creés que el chico tiró tus papeles al suelo a propósito o por accidente?,¿Crees que el chico tiró tus papeles al suelo a propósito o por accidente?,"Glaubst du, der Junge hat deine Papiere absichtlich oder aus Versehen auf den Boden geworfen?",NO APPROVED TRANSLATION,,"Ĉu vi pensas, ke la knabo puŝis viajn paperojn sur la plankon intence aŭ akcidente?",NO APPROVED TRANSLATION,,
hostile-attribution-scene3-q2,hostile-attribution,Now pick one of the three choices as the one you would do:,Ahora elegí cuál de estas tres opciones harías vos:,Ahora escoge cuál de estas tres opciones harías tú:,Was würdest du tun? Wähle eine der drei Möglichkeiten aus.,NO APPROVED TRANSLATION,,Nun elektu unu el la tri ebloj kiel la unu kiun vi farus:,NO APPROVED TRANSLATION,,
hostile-attribution-scene3-q2-ans1,hostile-attribution,call him a name,insultar al niño,insultar al niño,ihn beleidigen,NO APPROVED TRANSLATION,,voki lin per nomo,NO APPROVED TRANSLATION,,
hostile-attribution-scene3-q2-ans2,hostile-attribution,pick up the papers,levantar los papeles,recoger los papeles,die Papiere aufsammeln,NO APPROVED TRANSLATION,,kolekti la paperojn,NO APPROVED TRANSLATION,,
hostile-attribution-scene3-q2-ans3,hostile-attribution,do nothing,no hacer nada,no hacer nada,nichts tun,NO APPROVED TRANSLATION,,fari nenion,NO APPROVED TRANSLATION,,
instructions,general,instructions,instrucciones,instrucciones,Anweisungen,NO APPROVED TRANSLATION,,instrukcioj,NO APPROVED TRANSLATION,,instruções
intro-finished,general,You've finished the instructions. Thank you!,Terminaste las instrucciones. ¡Gracias!,Has terminado las instrucciones. ¡Gracias!,Das war die Spielanleitung. Vielen Dank!,NO APPROVED TRANSLATION,,Vi finis la instrukciojn. Dankon!,NO APPROVED TRANSLATION,,Você terminou as instruções. Obrigado!
large_cup,theory-of-mind,The big cup,La taza grande,La taza grande,Die große Tasse,NO APPROVED TRANSLATION,,La granda taso,NO APPROVED TRANSLATION,De grote beker,
math-instructions1,egma-math,"In this game, you will do some math problems. Some will be like the ones you do in school and some will be a little different than what you do in school. 

Some questions might be easy for you and some might be hard. That is okay! Please try your best and take your time. Most of the questions will have four choices. You choose the one you think is right. Let’s get started!","En este juego, harás algunos problemas de matemáticas. Algunos serán como los que hacés en la escuela y otros serán un poco diferentes de los que hacés en la escuela. 

Algunas preguntas te resultarán fáciles y otras difíciles. ¡No pasa nada! Esforzate al máximo y tomate tu tiempo. La mayoría de las preguntas tienen cuatro opciones. Elegí la que consideres correcta. ¡Empecemos!",NO APPROVED TRANSLATION,"In diesem Spiel wirst du einige mathematische Aufgaben lösen. Einige sind wie die, die du in der Schule machst, und einige sind etwas anders als die, die du in der Schule machst. 

Einige Fragen könnten leicht für dich sein und einige könnten schwer sein. Das ist nicht schlimm! Bitte gib dein Bestes und nimm dir Zeit. Bei den meisten Fragen gibt es vier Auswahlmöglichkeiten. Du wählst die aus, die du für richtig hältst. Los geht's!",NO APPROVED TRANSLATION,"In this game, you will do some maths problems. Some will be like the ones you do in school and some will be a little different than what you do in school. 

Some questions might be easy for you and some might be hard. That is okay! Please try your best and take your time. Most of the questions will have four choices. You choose the one you think is right. Let’s get started!","En ĉi tiu ludo, vi solvos kelkajn matematikajn problemojn. Iuj similos al la problemoj, kiujn vi faras en la lernejo, kaj iuj estos iom malsamaj ol tiuj, kiujn vi faras en la lernejo.

Iuj demandoj povus esti facilaj por vi kaj aliaj povus esti malfacilaj. Tio estas en ordo! Bonvolu fari vian plej bonan kaj preni vian tempon. Plejparto de la demandoj havos kvar eblojn. Vi elektas tiun, kiun vi pensas ĝusta. Ni komencu!",NO APPROVED TRANSLATION,"In dit spel ga je wat rekensommen maken. Sommige lijken op de sommen die je op school doet en sommige zijn net iets anders dan op school. 

Sommige vragen kunnen makkelijk voor je zijn en andere kunnen moeilijk zijn. Dat is oké! Doe je best en neem de tijd. De meeste vragen hebben vier keuzes. Kies degene waarvan je denkt dat die juist is. Laten we beginnen!","Neste jogo, você vai fazer contas de matemática. Algumas serão como as que você faz na escola e algumas serão um pouco diferentes das que você faz na escola.

Algumas perguntas podem ser fáceis para você e outras podem ser difíceis. Faça o seu melhor e responda com calma. A maioria das perguntas terá quatro opções. Escolha a que você acha que é a correta. Vamos começar!"
math-instructions1-heavy,egma-math,"In this game, you will play with numbers.

Some questions might be easy for you and some might be hard. That is okay! Please try your best and take your time. Let’s get started!","En este juego, jugarás con números.

Algunas preguntas pueden ser fáciles para vos y algunas pueden ser difíciles. ¡Está bien! Hacé tu mejor esfuerzo y tomate tu tiempo. ¡Comencemos!",NO APPROVED TRANSLATION,"In diesem Spiel wirst du mit Zahlen spielen.

Einige Fragen könnten einfach für dich sein und andere schwer. Das ist in Ordnung! Bitte gib dein Bestes und nimm dir Zeit. Lass uns beginnen!",NO APPROVED TRANSLATION,"In this game, you will play with numbers.

Some questions might be easy for you and some might be hard. That is okay! Please try your best and take your time. Let’s get started!","En ĉi tiu ludo, vi ludos kun nombroj.

Iuj demandoj eble estos facilaj por vi kaj iuj eble estos malfacilaj. Tio estas bone! Bonvolu fari vian plej bonan kaj preni tempon. Ni komencu!",NO APPROVED TRANSLATION,"In dit spel ga je met getallen spelen.

Sommige vragen zijn misschien makkelijk voor je en sommige moeilijk. Dat is prima! Probeer je best te doen en neem de tijd. Laten we beginnen!","Neste jogo, você vai brincar com números.

Algumas perguntas podem ser fáceis para você e outras podem ser difíceis. Faça o seu melhor e leve o tempo que precisar. Vamos começar!"
math-intro-fractions,egma-math,In this section sometimes you will add and sometimes you will subtract. Be sure to look carefully for the plus or minus sign. The first few are for practice.,En esta sección a veces tenés que sumar y a veces tenés que restar. Fijate bien en el signo de suma o resta. Los primeros son para practicar.,En esta sección a veces tienes que sumar y a veces tienes que restar. Fíjate bien en el signo de suma o resta. Los primeros son para practicar.,"In diesem Teil musst du manchmal addieren und manchmal subtrahieren. Schau also genau, ob da ein Plus oder ein Minus steht. Die ersten paar sind wieder zum Üben.",NO APPROVED TRANSLATION,In this section sometimes you will add and sometimes you will subtract. Be sure to look carefully for the plus or minus sign. The first few are for practice.,En ĉi tiu sekcio foje vi aldonos kaj foje vi subtrahos. Certiĝu rigardi atente por la plus- aŭ minus-signo. La unuaj kelkaj estas por praktiko.,NO APPROVED TRANSLATION,In dit gedeelte zal je soms optellen en soms aftrekken. Zorg ervoor dat je goed kijkt naar het plus- of minteken. De eerste paar zijn om te oefenen.,"Nesta seção, às vezes você vai somar e às vezes vai diminuir. Olhe os sinais de mais ou de menos com cuidado. As primeiras são para praticar."
math-intro1,egma-math,Here is the first section. Let's start with some practice!,Esta es la primera sección. ¡Empecemos a practicar!,NO APPROVED TRANSLATION,Hier kommt der erste Teil. Am Anfang üben wir erstmal nur.,NO APPROVED TRANSLATION,Here is the first section. Let's start with some practice!,Jen la unua sekcio. Ni komencu kun iom da praktiko!,NO APPROVED TRANSLATION,Hier is het eerste gedeelte. Laten we beginnen met wat te oefenen!,Aqui está a primeira seção. Vamos começar com um pouco de prática!
math-intro1-heavy,egma-math,It's time for the first number game! Let's practice.,¡Es hora del primer juego de números! Vamos a practicar.,¡Es hora del primer juego de números! Vamos a practicar.,Es ist Zeit für das erste Zahlenspiel! Lass uns üben.,NO APPROVED TRANSLATION,It's time for the first number game! Let's practice.,Estas tempo por la unua nombroludo! Ni praktiku.,NO APPROVED TRANSLATION,Het is tijd voor het eerste getallenspel! Laten we oefenen.,É hora do primeiro jogo de números! Vamos praticar.
math-intro2,egma-math,Here is another section. The first few are for practice.,Esta es otra sección. Las primeras son para practicar.,Esta es otra sección. Las primeras son para practicar.,Jetzt kommt der nächste Teil. Die ersten paar sind wieder zum Üben.,NO APPROVED TRANSLATION,Here is another section. The first few are for practice.,Jen alia sekcio. La unuaj kelkaj estas por praktiko.,NO APPROVED TRANSLATION,Hier is nog een gedeelte. De eerste paar zijn om te oefenen.,Aqui está outra seção. As primeiras são para praticar.
math-intro2-heavy,egma-math,It's time for the next number game! Let's practice.,¡Es hora del siguiente juego de números! Vamos a practicar.,¡Es hora del siguiente juego de números! Vamos a practicar.,Es ist Zeit für das nächste Zahlenspiel! Lass uns üben.,NO APPROVED TRANSLATION,It's time for the next number game! Let's practice.,Estas tempo por la sekva nombroludo! Ni praktiku.,NO APPROVED TRANSLATION,Het is tijd voor het volgende getallenspel! Laten we oefenen.,É hora do próximo jogo de números! Vamos praticar.
matrix-reasoning-feedback-incorrect-downex,matrix-reasoning,This one is right because it fits.,Este es correcto porque encaja.,NO APPROVED TRANSLATION,NO APPROVED TRANSLATION,NO APPROVED TRANSLATION,This one is right because it fits.,Ĉi tiu estas ĝusta ĉar ĝi taŭgas.,NO APPROVED TRANSLATION,Dit is de goede omdat hij past.,
matrix-reasoning-feedback-sm-blue-downex,matrix-reasoning,This piece is right because it is the only piece that is small and blue.,Esta pieza es correcta porque es la única pieza que es pequeña y azul.,NO APPROVED TRANSLATION,NO APPROVED TRANSLATION,NO APPROVED TRANSLATION,This piece is right because it is the only piece that is small and blue.,Ĉi tiu peco estas ĝusta ĉar ĝi estas la sola peco kiu estas malgranda kaj blua.,NO APPROVED TRANSLATION,"Dit stuk klopt, want het is het enige stuk dat klein en blauw is.",
