item_id,task,en-US,es-AR,es-CO,de-DE,ar-IL,en-GB,eo-UY,he-IL,nl-NL,pt-BR
ToM-scene2-instruct1,theory-of-mind,"This morning when he came to school, Ethan put his book on the shelf above the coat hooks. Ethan’s book is blue!","Esta mañana, cuando vino a la escuela, Elián puso su libro sobre el estante encima de los percheros para los abrigos. El libro de Elián es azul.","Esta mañana, cuando vino a la escuela, Elián puso su libro sobre la repisa encima de los colgaderos de abrigos. El libro de Elián es azul.","Heute Morgen, als er in die Schule kam, hat Justus sein Buch auf die Garderobe über den Mänteln gelegt. Das Buch von Justus ist blau!",NO APPROVED TRANSLATION,,"Ĉi-matene, kiam li venis al la lernejo, Ethan metis sian libron sur la breton super la hoko. La libro de Ethan estas blua",NO APPROVED TRANSLATION,"Toen hij vanmorgen op school kwam, legde Edwin zijn boek op de plank boven de kapstok. Edwins boek is blauw!",
ToM-scene2-instruct2,theory-of-mind,"And then he went outside to play, see? Here’s Ethan playing outside. And while he was outside playing, Ethan’s book fell down from above the coat hooks onto the floor under the coats, see?","Y luego salió a jugar, ¿ves? Aquí está Elián jugando afuera. Mientras Elián estaba afuera jugando, su libro se cayó del estante y quedó en el piso, debajo de los abrigos, ¿ves?","Y luego salió a jugar, ¿ves? Aquí está Elián jugando afuera. Mientras Elián estaba afuera jugando, su libro se cayó de la repisa y quedó en el piso, debajo de los abrigos, ¿ves?","Und dann ist er nach draußen gegangen, um zu spielen, siehst du? Hier ist Justus beim Spielen draußen. Und während er draußen spielte, fiel das Buch von Justus von der Garderobe auf den Boden unter die Mäntel, siehst du?",NO APPROVED TRANSLATION,,"Kaj tiam li iris eksterludi, ĉu vi vidas? Jen Ethan ludanta ekstere. Kaj dum li ludis ekstere, la libro de Ethan falis de super la hoko al la planko sub la manteloj, ĉu vi vidas",NO APPROVED TRANSLATION,"En toen ging hij naar buiten om te spelen, zie je? Hier is Edwin buiten aan het spelen. En terwijl hij buiten aan het spelen was, viel Edwins boek van boven de kapstok op de grond onder de jassen, zie je?",
ToM-scene2-instruct3,theory-of-mind,"Then Hannah comes in and Hannah puts her book up above the coat hooks. Hannah's book is also blue! Ethan is still outside playing, so he didn't see what Hannah was doing.","Luego entró Ana y puso su libro sobre el estante encima de los percheros. ¡El libro de Ana también es azul! Como Elián todavía está afuera jugando, no vio lo que hizo Ana.","Luego entró Ana y puso su libro sobre la repisa encima de los colgaderos. ¡El libro de Ana también es azul! Como Elián todavía está afuera jugando, no vio lo que hizo Ana.","Dann kommt Hannah herein und legt ihr Buch auf die Garderobe über den Mänteln. Hannahs Buch ist auch blau! Justus ist noch draußen und spielt, deshalb hat er nicht gesehen, was Hannah gemacht hat.",NO APPROVED TRANSLATION,,"Tiam Hannah envenas kaj Hannah metas sian libron super la hokojn. Ankaŭ la libro de Hannah estas blua! Ethan ankoraŭ estas ekstere ludanta, do li ne vidis kion Hannah faris.",NO APPROVED TRANSLATION,"Dan komt Hannah binnen en Hannah legt haar boek boven de kapstok. Hannahs boek is ook blauw! Edwin is nog buiten aan het spelen, dus hij zag niet wat Hannah aan het doen was.",
ToM-scene2-instruct4,theory-of-mind,"Let’s see what he does. Oh look, here is Ethan reaching for this book up on the shelf. And now Hannah sees Ethan reaching for that book... the book that is Hannah's!","Veamos lo que hace Elián. Oh, mirá, Elián está agarrando el libro que está sobre el estante. Y ahora Ana ve a Elián agarrando ese libro... ¡el libro que es de Ana!","Veamos lo que Elián hace. Oh, mira, Elián está cogiendo el libro que está sobre la repisa. Y ahora Ana ve a Elián cogiendo ese libro... ¡el libro que es de Ana!","Mal sehen, was er macht. Oh, sieh mal, da ist Justus. Er greift nach dem Buch oben im Regal. Und jetzt sieht Hannah, wie Justus nach dem Buch greift... dem Buch, das Hannah gehört!",NO APPROVED TRANSLATION,,"Ni vidu kion li faras. Ho rigardu, ĉi tie estas Ethan atinganta ĉi tiun libron sur la breto. Kaj nun Hannah vidas Ethan atinganta tiun libron... la libron kiu apartenas al Hannah!",NO APPROVED TRANSLATION,"Laten we eens kijken wat hij doet. Oh kijk, hier is Edwin die dit boek op de plank wil pakken. En nu ziet Hannah dat Edwin dat boek wil pakken... het boek dat van Hannah is!",
ToM-scene2-q1-false_belief,theory-of-mind,"Now, when Ethan comes in from outside, where will he look first for his book?","Entonces, cuando Elián regrese, ¿dónde buscará primero su libro?","Entonces, cuando Elián regrese, ¿dónde buscará primero su libro?","Wenn Justus nun von draußen hereinkommt, wo wird er zuerst nach seinem Buch suchen?",NO APPROVED TRANSLATION,,"Nun, kiam Ethan envenos de ekstere, kie li unue serĉos sian libron?",NO APPROVED TRANSLATION,"Dus, als Edwin van buiten binnenkomt, waar zal hij dan als eerste naar zijn boek zoeken?",
ToM-scene2-q2-emotion_reasoning,theory-of-mind,How do you think Hannah feels about Ethan reaching for that book?,¿Cómo creés que se siente Ana cuando Elián agarra ese libro?,¿Cómo crees que se siente Ana cuando Elián coge ese libro?,"Was glaubst du, was Hannah davon hält, dass Justus nach dem Buch greift?",NO APPROVED TRANSLATION,,Kiel vi pensas ke Hannah sentas pri Ethan atinganta tiun libron,NO APPROVED TRANSLATION,Hoe denk je dat Hannah zich voelt over dat Edwin dat boek pakt?,
ToM-scene2-q3-false_belief,theory-of-mind,Is Ethan being mean and naughty for taking Hannah's book?,¿Elián está siendo malo y travieso al agarrar el libro de Ana?,¿Elián está siendo malo y travieso al tomar el libro de Ana?,"Ist es gemein und frech von Justus, dass er Hannahs Buch genommen hat?",NO APPROVED TRANSLATION,,Ĉu Ethan estas malica kaj petola pro prenado de la libro de Hannah?,NO APPROVED TRANSLATION,"Is Edwin gemeen en ondeugend, omdat hij Hannahs boek heeft meegenomen?",
ToM-scene2-q4-false_belief,theory-of-mind,Should Ethan get in trouble with the teacher for taking Hannah's book?,¿Debería Elián estar en problemas con el maestro por agarrar el libro de Ana?,¿Debería Elián estar en problemas con el maestro por tomar el libro de Ana?,"Sollte Justus Ärger mit der Lehrerin bekommen, weil er Hannahs Buch genommen hat?",NO APPROVED TRANSLATION,,Ĉu Ethan devus ricevi problemon kun la instruisto pro prenado de la libro de Hannah?,NO APPROVED TRANSLATION,"Zou Edwin op zijn kop moeten krijgen van de leraar, omdat hij Hannahs boek heeft meegenomen?",
ToM-scene2-q5-reality_check,theory-of-mind,Can you help Hannah find her book? Is it on the shelf or under the coats?,¿Podés ayudar a Ana a encontrar su libro? ¿Está sobre el estante o debajo de los abrigos?,¿Puedes ayudar a Ana a encontrar su libro? ¿Está sobre la repisa o debajo de los abrigos?,"Kannst du Hannah helfen, ihr Buch zu finden? Ist es auf dem Regal oder unter den Mänteln?",NO APPROVED TRANSLATION,,Ĉu vi povas helpi Hannah trovi ŝian libron? Ĉu ĝi estas sur la breto aŭ sub la manteloj?,NO APPROVED TRANSLATION,Kan jij Hannah helpen haar boek te vinden? Ligt op de plank of onder de jassen?,
ToM-scene2-q6-reality_check,theory-of-mind,Can you help Ethan find his book? Is it on the shelf or under the coats?,¿Podés ayudar a Elián a encontrar su libro? ¿Está sobre el estante o debajo de los abrigos?,NO APPROVED TRANSLATION,"Kannst du Justus helfen, sein Buch zu finden? Ist es auf dem Regal oder unter den Mänteln?",NO APPROVED TRANSLATION,,Ĉu vi povas helpi Ethan trovi lian libron? Ĉu ĝi estas sur la breto aŭ sub la manteloj?,NO APPROVED TRANSLATION,Kan jij Edwin helpen zijn boek te vinden? Ligt het op de plank of onder de jassen?,
ToM-scene2-q7-emotion_reasoning,theory-of-mind,How do you think Hannah would feel if she had not seen Ethan reaching for the book?,¿Cómo creés que se sentiría Ana si no hubiera visto a Elián agarrar el libro?,¿Cómo crees que se sentiría Ana si no hubiera visto a Elián coger el libro?,"Wie würde sich Hannah wohl fühlen, wenn sie nicht gesehen hätte, wie Justus nach dem Buch greift?",NO APPROVED TRANSLATION,,Kiel vi pensas ke Hannah sentus sin se ŝi ne vidus Ethan atinganta la libron?,NO APPROVED TRANSLATION,"Hoe denk je dat Hannah zich zou voelen, als ze niet had gezien dat Edwin het boek pakte?",
ToM-scene3-instruct1,theory-of-mind,"Joshua, Isabel, and Ivan are playing a game. Here's how the game goes: One kid hides, but draws a clue in the sandbox so the other kids can find them.","Josué, Isabel e Iván están jugando. El juego es el siguiente: Uno de los niños se esconde, pero debe dibujar una pista en el arenero que permita a los otros niños encontrarlo.","Johan, Isabel e Iván están jugando. El juego es el siguiente: Uno de los niños se esconde, pero debe dibujar una pista en la arena que permita a los otros niños encontrarlo.","Johann, Lisa und Max spielen ein Spiel. Das Spiel geht so: Ein Kind versteckt sich, malt aber einen Hinweis in den Sandkasten, damit die anderen Kinder es finden können.",NO APPROVED TRANSLATION,,"Joshua, Isabel, kaj Ivan ludas ludon. Jen kiel la ludo iras: Unu infano kaŝiĝas, sed desegnas indikon en la sablujo por ke la aliaj infanoj povu trovi ilin",NO APPROVED TRANSLATION,"Joshua, Isabel en Ivan spelen een spelletje. Zo gaat het spelletje: Een kind verstopt zich, maar tekent een aanwijzing in de zandbak, zodat de andere kinderen hem/haar kunnen vinden.",
ToM-scene3-instruct2,theory-of-mind,"So Ivan is going first. He draws this clue in the sandbox, and then he goes to hide.","Entonces, Iván va primero. Dibuja esta pista en el arenero y se esconde.","Entonces, Iván va primero. Dibuja esta pista en la arena y se esconde.",Max fängt an. Er malt einen Hinweis in den Sandkasten und versteckt sich dann.,NO APPROVED TRANSLATION,,"Do Ivan iros unue. Li desegnas ĉi tiun indikon en la sablujo, kaj poste li iras por kaŝiĝi",NO APPROVED TRANSLATION,Dus Ivan gaat als eerste. Hij tekent deze aanwijzing in de zandbak en gaat zich dan verstoppen.,
ToM-scene3-instruct3,theory-of-mind,"Now it's Joshua's turn to leave a clue, and hide. Isabel and Ivan will then try to use the clue to find him.",Ahora le toca a Josué dejar una pista y esconderse. Isabel e Iván intentarán utilizar la pista para encontrarlo.,Ahora le toca a Johan dejar una pista y esconderse. Isabel e Iván intentarán utilizar la pista para encontrarlo.,"Jetzt ist Johann an der Reihe, einen Hinweis zu hinterlassen und sich zu verstecken. Lisa und Max werden dann versuchen, den Hinweis zu nutzen, um ihn zu finden.",NO APPROVED TRANSLATION,,Nun estas la vico de Joshua por lasi indikon kaj kaŝiĝi. Isabel kaj Ivan tiam provos uzi la indikon por trovi lin.,NO APPROVED TRANSLATION,Nu is het Jips beurt om een aanwijzing achter te laten en zich te verstoppen. Isabel en Ivan zullen dan proberen de aanwijzing te gebruiken om hem te vinden.,
ToM-scene3-instruct4,theory-of-mind,"Joshua decides to hide behind the fountain. He draws a clue in the sand. He tries to draw the fountain, with the bottom part and the water coming out of it. But the drawing looks like a tree instead! Then Joshua goes and hides behind the fountain.","Josué decide esconderse detrás de la fuente. Dibuja una pista en la arena. Intenta dibujar la parte inferior de la fuente y el agua que sale de ella, ¡pero el dibujo que hace parece un árbol! Ahora, Josué se esconde detrás de la fuente.","Johan decide esconderse detrás de la fuente. Él dibuja una pista en la arena. Él intenta dibujar la parte inferior de la fuente y el agua que sale de ella, ¡pero el dibujo que hace parece un árbol! Ahora, Johan se esconde detrás de la fuente.","Johann beschließt, sich hinter dem Springbrunnen zu verstecken. Er zeichnet einen Hinweis in den Sand. Er versucht, den Springbrunnen zu zeichnen, mit dem unteren Teil und dem Wasser, das aus ihm herauskommt. Aber die Zeichnung sieht stattdessen wie ein Baum aus! Dann versteckt sich Johann hinter dem Springbrunnen.",NO APPROVED TRANSLATION,,"Joshua decidas kaŝiĝi malantaŭ la fontano. Li desegnas indikon en la sablo. Li provas desegni la fontanon, kun la fundo kaj la akvo elvenanta el ĝi. Sed la desegno anstataŭe aspektas kiel arbo! Poste Joshua iras kaj kaŝiĝas malantaŭ la fontano.",NO APPROVED TRANSLATION,"Jip besluit zich achter de fontein te verstoppen. Hij tekent een aanwijzing in het zand. Hij probeert de fontein te tekenen, met het onderste gedeelte en het water dat eruit komt. Maar de tekening lijkt in plaats daarvan op een boom! Dan gaat Jip zich verstoppen achter de fontein.",
ToM-scene3-q1,theory-of-mind,What did Joshua mean to draw?,¿Qué quería dibujar Josué?,¿Qué quería dibujar Johan?,Was wollte Johann zeichnen?,NO APPROVED TRANSLATION,,Kion Joshua intencis desegni?,NO APPROVED TRANSLATION,Wat wilde Jip tekenen?,
ToM-scene3-q2-false_belief,theory-of-mind,"When Isabel and Ivan see this clue, where will they look first for Joshua?","Cuando Isabel e Iván vean esta pista, ¿dónde buscarán primero a Josué?","Cuando Isabel e Iván vean esta pista, ¿dónde buscarán primero a Johan?","Sobald Lisa und Max diesen Hinweis sehen, wo werden sie zuerst nach Johann suchen?",NO APPROVED TRANSLATION,,"Kiam Isabel kaj Ivan vidas ĉi tiun indikon, kie ili unue serĉos Joshua",NO APPROVED TRANSLATION,"Als Isabel en Ivan deze aanwijzing zien, waar zullen ze  dan als eerste naar Jip zoeken?",
ToM-scene3-q2-reality_check,theory-of-mind,Can you help them find where Joshua really is?,¿Podés ayudarlos a encontrar dónde está realmente Josué?,¿Puedes ayudarles a encontrar dónde está realmente Johan?,"Kannst du ihnen helfen, herauszufinden, wo Johann wirklich ist?",NO APPROVED TRANSLATION,,Ĉu vi povas helpi ilin trovi kie Joshua vere estas?,NO APPROVED TRANSLATION,Kun jij ze helpen ontdekken waar Jip werkelijk is?,
ToM-scene3-q3-emotion_reasoning,theory-of-mind,"Look, Isabel and Ivan found Joshua, and won the game! How do you think Isabel feels about winning the game?","¡Mirá, Isabel e Iván encontraron a Josué y ganaron el juego! ¿Cómo creés que se siente Isabel por ganar el juego?","¡Mira, Isabel e Iván encontraron a Johan y ganaron el juego! ¿Cómo crees que se siente Isabel por ganar el juego?","Schau, Lisa und Max haben Johann gefunden und das Spiel gewonnen! Was glaubst du, wie Lisa sich fühlt, weil sie das Spiel gewonnen hat?",NO APPROVED TRANSLATION,,"Rigardu, Isabel kaj Ivan trovis Joshuan kaj venkis la ludon! Kiel vi pensas ke Isabel sentas pri venki la ludon?",NO APPROVED TRANSLATION,"Kijk, Isabel en Ivan hebben Jip gevonden en het spel gewonnen! Hoe denk je dat Isabel zich voelt over het winnen van het spel?",
ToM-scene4-instruct1,theory-of-mind,"Now the games are over, and it's almost time to go home. Mother tells the kids to find all of their toys.",Ya se acabaron los juegos y es hora de volver a casa. Mamá les dice a los niños que busquen todos sus juguetes.,Ya se acabaron los juegos y es hora de volver a casa. Mamá les dice a los niños que busquen todos sus juguetes.,"Jetzt sind die Spiele vorbei, und es ist Zeit, nach Hause zu gehen. Die Mutter sagt den Kindern, sie sollen alle ihre Spielsachen einsammeln.",NO APPROVED TRANSLATION,,"La ludoj nun finiĝis, kaj preskaŭ estas tempo iri hejmen. Patrino diras al la infanoj trovi ĉiujn iliajn ludilojn",NO APPROVED TRANSLATION,Nu zijn de spelletjes afgelopen en is het bijna tijd om naar huis te gaan. Moeder zegt tegen de kinderen dat ze al hun speelgoed moeten verzamelen.,
ToM-scene4-instruct2,theory-of-mind,"Joshua brought his toy truck with him to the park, but now he can't find it. He's looking everywhere but he can't find it.","Josué trajo su camión de juguete al parque, pero ahora no lo encuentra. Lo busca por todas partes, pero no puede encontrarlo.","Johan trajo su camión de juguete al parque, pero ahora no lo encuentra. Lo busca por todas partes, pero no puede encontrarlo.","Johann hat seinen Spielzeuglaster mit in den Park genommen, aber jetzt kann er ihn nicht mehr finden. Er sucht überall, aber er kann ihn nicht finden.",NO APPROVED TRANSLATION,,"Joshua alportis sian ludkamionon al la parko, sed nun li ne povas ĝin trovi. Li serĉas ĉie, sed ne povas ĝin trovi",NO APPROVED TRANSLATION,"Joshua heeft zijn speelgoedvrachtwagen meegenomen naar het park, maar nu kan hij hem niet vinden. Hij zoekt overal, maar hij kan hem niet vinden.",
ToM-scene4-instruct3,theory-of-mind,"Joshua can't find his truck because earlier in the day, when no one was looking, Isabel took the toy truck and buried it in the sandbox.","Josué no encuentra su camión porque antes, cuando nadie miraba, Isabel agarró el camión de juguete y lo enterró en la arena.","Johan no encuentra su camión porque antes, cuando nadie miraba, Isabel cogió el camión de juguete y lo enterró en la arena.","Johann kann seinen Lastwagen nicht finden, weil Lisa vorhin, als niemand hinsah, den Spielzeuglastwagen genommen und im Sandkasten vergraben hat.",NO APPROVED TRANSLATION,,"Joshua ne povas trovi sian kamionon ĉar pli frue tiutage, kiam neniu rigardis, Isabel prenis la ludkamionon kaj enterigis ĝin en la sablokesto",NO APPROVED TRANSLATION,"Jip kan zijn vrachtwagen niet vinden, want eerder die dag, toen niemand keek, heeft Isabel de speelgoedvrachtwagen gepakt en in de zandbak begraven.",
ToM-scene4-instruct4,theory-of-mind,"So Joshua looks everywhere and he can't find his toy truck. Mother gets mad at Joshua, because he lost his truck.","Por eso, Josué mira por todas partes y no encuentra su camión de juguete. Mamá se enoja con Josué porque perdió el camión.","Por eso, Johan mira por todas partes y no encuentra su camión de juguete. Mamá se enoja con Johan porque perdió el camión.","Johann sucht also überall, aber er kann seinen Spielzeug-LKW nicht finden. Seine Mutter wird wütend auf Johann, weil er seinen Laster verloren hat.",NO APPROVED TRANSLATION,,"Do Joshua serĉas ĉie kaj li ne povas trovi sian ludkamionon. Patrino koleras je Joshua, ĉar li perdis sian kamionon.",NO APPROVED TRANSLATION,"Dus Jip zoekt overal en hij kan zijn speelgoedvrachtwagen niet vinden. Moeder wordt boos op Jip, omdat hij zijn vrachtwagen kwijt is.",
ToM-scene4-instruct5,theory-of-mind,"When Isabel sees that Mother is mad at Joshua, she goes to the sandbox and digs up the toy truck, and gives it back to Joshua.","Cuando Isabel se da cuenta de que Mamá está enojada con Josué, va al arenero, saca el juguete de la arena y se lo devuelve a Josué.","Cuando Isabel se da cuenta de que Mamá está enojada con Johan, va al patio de arena, saca el juguete de la arena y se lo devuelve a Johan.","Als Lisa sieht, dass Mutter böse auf Johann ist, geht sie zum Sandkasten, gräbt den Spielzeuglaster aus und gibt ihn Johann zurück.",NO APPROVED TRANSLATION,,"Kiam Isabel vidas ke Patrino koleras je Joshua, ŝi iras al la sablokesto kaj elterigas la ludkamionon kaj redonas ĝin al Joshua.",NO APPROVED TRANSLATION,"Als Isabel ziet dat moeder boos is op Jip, gaat ze naar de zandbak, graaft de speelgoedvrachtwagen op en geeft hem terug aan Jip.",
ToM-scene4-instruct6,theory-of-mind,"Isabel tells Joshua that she’s very sorry, and she gives him a big hug. Joshua gives her a big hug back, and Mother joins in.","Isabel le pide disculpas a Josué y le da un fuerte abrazo. Josué le devuelve el abrazo, y Mamá se une a ellos.","Isabel le pide disculpas a Johan y le da un fuerte abrazo. Johan le devuelve el abrazo, y Mamá se une a ellos.","Lisa sagt Johann, dass es ihr sehr leid tut, und sie gibt ihm eine große Umarmung. Johann erwidert die Umarmung, und auch Mutter schließt sich ihr an.",NO APPROVED TRANSLATION,,"Isabel diras al Joshua ke ŝi tre bedaŭras, kaj ŝi donas al li grandan brakumon. Joshua redonas al ŝi grandan brakumon, kaj Patrino aniĝas.",NO APPROVED TRANSLATION,Isabel vertelt Jip dat het haar heel erg spijt en ze geeft hem een dikke knuffel. Jip geeft haar een dikke knuffel terug en Moeder doet mee.,
ToM-scene4-q1-emotion_reasoning,theory-of-mind,How does Joshua feel about losing his truck?,¿Cómo se siente Josué por perder su camión?,¿Cómo se siente Johan por perder su camión?,Was denkt Johann über den Verlust seines Lastwagens?,NO APPROVED TRANSLATION,,Kiel Joshua sentas pro perdi sian kamionon?,NO APPROVED TRANSLATION,Hoe voelt Jip zich over het kwijtraken van zijn vrachtwagen?,
ToM-scene4-q2,theory-of-mind,Is it fair that Mother is mad at Joshua for losing his truck?,¿Es justo que Mamá se enoje con Josué por haber perdido su camión?,¿Es justo que Mamá se enoje con Johan por haber perdido su camión?,"Ist es fair, dass Mutter böse auf Johann ist, weil er seinen Spielzeuglaster verloren hat?",NO APPROVED TRANSLATION,,"Ĉu estas juste, ke Patrino koleras je Joshua, ĉar li perdis sian kamionon?",NO APPROVED TRANSLATION,"Is het eerlijk dat moeder boos is op Jip, omdat hij zijn vrachtwagen kwijt is?",
ToM-scene4-q3,theory-of-mind,Is Mother mad at Isabel?,¿Mamá está enojada con Isabel?,¿Mamá está enojada con Isabel?,Ist Mutter böse auf Lisa?,NO APPROVED TRANSLATION,,Ĉu Patrino koleras je Isabel?,NO APPROVED TRANSLATION,Is moeder boos op Isabel?,
ToM-scene4-q4-false_belief,theory-of-mind,Is Joshua mad at Isabel?,¿Josué está enojado con Isabel?,¿Johan está enojado con Isabel?,Ist Johann böse auf Lisa?,NO APPROVED TRANSLATION,,Ĉu Joshua koleras je Isabel?,NO APPROVED TRANSLATION,Is Jip boos op Isabel?,
ToM-scene4-q5,theory-of-mind,Is Mother mad at Joshua now?,¿Ahora Mamá está enojada con Josué?,¿Ahora Mamá está enojada con Johan?,Ist Mutter jetzt böse auf Johann?,NO APPROVED TRANSLATION,,Ĉu Patrino koleras je Joshua nun?,NO APPROVED TRANSLATION,Is moeder nu boos op Joshua?,
ToM-scene4-q6,theory-of-mind,Is Mother mad at Isabel now?,¿Ahora Mamá está enojada con Isabel?,¿Ahora Mamá está enojada con Isabel?,Ist Mutter jetzt böse auf Lisa?,NO APPROVED TRANSLATION,,Ĉu Patrino koleras je Isabel nun?,NO APPROVED TRANSLATION,Is moeder nu boos op Isabel?,
ToM-scene4-q7,theory-of-mind,Is Joshua mad at Isabel now?,¿Ahora Josué está enojado con Isabel?,¿Ahora Johan está enojado con Isabel?,Ist Johann jetzt böse auf Lisa?,NO APPROVED TRANSLATION,,Ĉu Joshua koleras je Isabel nun?,NO APPROVED TRANSLATION,Is Jip nu boos op Isabel?,
ToM-scene4-q8-emotion_reasoning,theory-of-mind,How would Joshua feel if he found his truck?,¿Cómo se sentiría Josué si encontrara su camión?,¿Cómo se sentiría Johan si encontrara su camión?,"Wie würde sich Johann fühlen, wenn er seinen Lastwagen finden würde?",NO APPROVED TRANSLATION,,Kiel Joshua sentus se li trovus sian kamionon?,NO APPROVED TRANSLATION,Hoe zou Jip zich voelen als hij zijn vrachtwagen zou vinden?,
ToM-scene5-instruct1,theory-of-mind,"This is Katie. Earlier today, Katie's mom was cleaning the house, while Katie watched. Mom left three cups in the kitchen. There is a small cup on the counter, a medium sized cup on the table, and a big cup that she put away up high, on the shelf.","Ella es Carla. Hace un rato, la mamá de Carla limpiaba la casa mientras Carla observaba. La mamá dejó tres tazas en la cocina: hay una taza pequeña en la barra, una taza mediana en la mesa y una taza grande en un estante que está muy alto.",NO APPROVED TRANSLATION,"Das ist Katie. Heute früh hat die Mama von Katie das Haus geputzt, während Katie zugesehen hat. Mama hat drei Tassen in der Küche stehen lassen. Da ist eine kleine Tasse auf dem Tresen, eine mittelgroße Tasse auf dem Tisch und eine große Tasse, die sie ganz oben auf das Regal gestellt hat.",NO APPROVED TRANSLATION,,"Ĉi tiu estas Katie. Pli frue hodiaŭ, la patrino de Katie purigis la domon, dum Katie rigardis. Panjo lasis tri tasojn en la kuirejo. Estas malgranda taso sur la kontrejo, meza taso sur la tablo, kaj granda taso kiun ŝi metis alte, sur la breton",NO APPROVED TRANSLATION,"Dit is Kim. Eerder vandaag was Kims moeder het huis aan het schoonmaken, terwijl Kim toekeek. Moeder liet drie koppen in de keuken staan. Er staat een klein kopje op het aanrecht, een middelgrote beker op tafel en een grote beker die ze hoog op de plank heeft gezet.",
ToM-scene5-instruct2,theory-of-mind,"Katie and Dad just walked in and Katie asks her dad to get her a cup. Katie tells her Dad, “I want the big cup!”","Carla y Papá acaban de entrar y Carla le pide a su papá que le dé una taza. Carla le dice a su papá ""¡quiero la taza grande!"".","Carla y Papá acaban de entrar y Carla le pide a su papá que le de una taza. Carla le dice a su papá ""¡quiero la taza grande!"".","Katie und Vater kommen in die Küche und Katie bittet ihren Vater, ihr eine Tasse zu geben. Katie sagt zu ihrem Vater: ""Ich möchte die große Tasse!""",NO APPROVED TRANSLATION,,"Katie kaj Paĉjo ĵus eniris kaj Katie petas sian paĉjon pri taso. Katie diras al sia paĉjo, “Mi volas la grandan taso!”",NO APPROVED TRANSLATION,"Kim en papa komen net binnen, en Kim vraagt haar vader om een beker voor haar te halen. Kim zegt tegen haar vader: ""Ik wil de grote beker!""",
ToM-scene5-q1,theory-of-mind,Which cup will Dad give Katie?,¿Cuál taza le dará el Papá a Carla?,¿Cuál taza le dará el Papá a Carla?,Welche Tasse wird Papa Katie geben?,NO APPROVED TRANSLATION,,Kiun taso paĉjo donos al Katie?,NO APPROVED TRANSLATION,Welke beker zal papa aan Kim geven?,
ToM-scene5-q2-reality_check,theory-of-mind,Which cup does Katie want?,¿Cuál taza quiere Carla?,¿Cuál taza quiere Carla?,Welche Tasse möchte Katie haben?,NO APPROVED TRANSLATION,,Kiun taso Katie volas?,NO APPROVED TRANSLATION,Welke beker wil Kim?,
