identifier,labels,text,es-CO,de
hostile-attribution-scene1-q1,hostile-attribution,Do you think that the boy bumped you on purpose or by accident?,Do you think that the boy bumped you on purpose or by accident?,Do you think that the boy bumped you on purpose or by accident?
hostile-attribution-scene1-q2,hostile-attribution,Now pick one of the three choices as the one you would do:,Now pick one of the three choices as the one you would do:,Now pick one of the three choices as the one you would do:
hostile-attribution-scene1-q2-ans1,hostile-attribution,clean up my shoes,clean up my shoes,clean up my shoes
hostile-attribution-scene1-q2-ans2,hostile-attribution,walk away from the boy,walk away from the boy,walk away from the boy
hostile-attribution-scene1-q2-ans3,hostile-attribution,push the boy in the mud,push the boy in the mud,push the boy in the mud
hostile-attribution-scene2-instruct1,hostile-attribution,"Imagine that you are on the playground. You and some other kids are having a race. A boy is standing on the side, bouncing a basketball.","Imagine that you are on the playground. You and some other kids are having a race. A boy is standing on the side, bouncing a basketball.","Imagine that you are on the playground. You and some other kids are having a race. A boy is standing on the side, bouncing a basketball."
hostile-attribution-scene2-instruct2,hostile-attribution,"The next thing you know, the boy has bounced the ball and it has rolled under your feet, making you fall. You skin your knee and someone else wins the race.","De repente, el chico hace rebotar la pelota y rueda bajo tus pies, haciéndote caer. Te raspas la rodilla, y alguien más gana la carrera.",Dann rollt der Ball von dem Jungen unter deine Füße und du fällst hin. Du schürfst dir das Knie auf und ein anderer gewinnt das Rennen.
hostile-attribution-scene2-q1,hostile-attribution,Do you think that the boy made you fall on purpose or by accident?,Do you think that the boy made you fall on purpose or by accident?,Do you think that the boy made you fall on purpose or by accident?
hostile-attribution-scene2-q2,hostile-attribution,Now pick one of the three choices as the one you would do:,Now pick one of the three choices as the one you would do:,Now pick one of the three choices as the one you would do:
hostile-attribution-scene2-q2-ans1,hostile-attribution,go to another area of the playground,go to another area of the playground,go to another area of the playground
hostile-attribution-scene2-q2-ans2,hostile-attribution,say something mean to him,say something mean to him,say something mean to him
hostile-attribution-scene2-q2-ans3,hostile-attribution,take care of my knee,take care of my knee,take care of my knee
hostile-attribution-scene3-instruct1,hostile-attribution,Imagine that you are working on an assignment at your desk. ,Imagine that you are working on an assignment at your desk. ,Imagine that you are working on an assignment at your desk. 
hostile-attribution-scene3-instruct2,hostile-attribution,"You go to sharpen your pencil, and as you walk back to your desk there is a boy walking just in front of you. The boy passes your desk before you get there. ","You go to sharpen your pencil, and as you walk back to your desk there is a boy walking just in front of you. The boy passes your desk before you get there. ","You go to sharpen your pencil, and as you walk back to your desk there is a boy walking just in front of you. The boy passes your desk before you get there. "
hostile-attribution-scene3-instruct3,hostile-attribution,"The next thing you know, the boy has knocked all of your papers off of your desk, and they are all over the floor.","The next thing you know, the boy has knocked all of your papers off of your desk, and they are all over the floor.","The next thing you know, the boy has knocked all of your papers off of your desk, and they are all over the floor."
hostile-attribution-scene3-q1,hostile-attribution,Do you think the boy knocked your papers onto the floor on purpose or by accident?,Do you think the boy knocked your papers onto the floor on purpose or by accident?,Do you think the boy knocked your papers onto the floor on purpose or by accident?
hostile-attribution-scene3-q2,hostile-attribution,Now pick one of the three choices as the one you would do:,Now pick one of the three choices as the one you would do:,Now pick one of the three choices as the one you would do:
hostile-attribution-scene3-q2-ans1,hostile-attribution,call him a name,call him a name,call him a name
hostile-attribution-scene3-q2-ans2,hostile-attribution,pick up the papers,pick up the papers,pick up the papers
hostile-attribution-scene3-q2-ans3,hostile-attribution,do nothing,do nothing,do nothing
hostile-attribution-scene1-by-accident,theory-of-mind,by accident,por accidente,aus Versehen
hostile-attribution-scene1-on-purpose,theory-of-mind,on purpose,a propósito,absichtlich
hostile-attribution-scene2-by-accident,theory-of-mind,by accident,por accidente,aus Versehen
hostile-attribution-scene2-on-purpose,theory-of-mind,on purpose,a propósito,absichtlich
hostile-attribution-scene3-by-accident,theory-of-mind,by accident,por accidente,aus Versehen
hostile-attribution-scene3-on-purpose,theory-of-mind,on purpose,a propósito,absichtlich
same-different-selection-instruct1,same-different-selection,"This is the matching game. In this game, you're going to choose sets of cards that match in some way. First, let's look at some of the cards you are going to see.","This is the matching game. In this game, you're going to choose sets of cards that match in some way. First, let's look at some of the cards you are going to see.","This is the matching game. In this game, you're going to choose sets of cards that match in some way. First, let's look at some of the cards you are going to see."
same-different-selection-touch-circle,same-different-selection,Choose the card with a circle.,Escoge la carta que tiene un círculo.,Wähle die Karte mit einem Kreis.
same-different-selection-touch-square,same-different-selection,Choose the card with a square.,Escoge la carta que tiene un cuadrado.,Wähle die Karte mit einem Quadrat. 
same-different-selection-touch-triangle,same-different-selection,Choose the card with a triangle.,Escoge la carta que tiene un triángulo.,Wähle die Karte mit einem Dreieck.
same-different-selection-touch-star,same-different-selection,Choose the card with a star.,Escoge la carta que tiene una estrella.,Wähle die Karte mit einem Stern.
same-different-selection-touch-green,same-different-selection,Choose the card with a green shape.,Escoge la carta que tiene una figura verde.,Wähle die Karte mit einer grünen Form.
same-different-selection-touch-red,same-different-selection,Choose the card with a red shape.,Escoge la carta que tiene una figura roja.,Wähle die Karte mit einer roten Form.
same-different-selection-touch-blue,same-different-selection,Choose the card with a blue shape.,Escoge la carta que tiene una figura azul.,Wähle die Karte mit einer blauen Form.
same-different-selection-touch-yellow,same-different-selection,Choose the card with a yellow shape.,Escoge la carta que tiene una figura amarilla.,Wähle die Karte mit einer gelben Form.
same-different-selection-touch-small,same-different-selection,Choose the card with a small shape.,Escoge la carta que tiene una figura pequeña.,Wähle die Karte mit einer kleinen Form.
same-different-selection-touch-medium,same-different-selection,Choose the card with a medium-sized shape.,Escoge la carta que tiene una figura mediana.,Wähle die Karte mit einer mittelgroßen Form.
same-different-selection-touch-large,same-different-selection,Choose the card with a large shape.,Escoge la carta que tiene una figura grande.,Wähle die Karte mit einer großen Form.
same-different-selection-touch-white,same-different-selection,Choose the star on the white card.,Escoge la estrella en la carta blanca.,Wähle den Stern auf der weißen Karte.
same-different-selection-touch-gray,same-different-selection,Choose the star on the gray card.,Escoge la estrella en la carta gris.,Wähle den Stern auf der grauen Karte.
same-different-selection-touch-black,same-different-selection,Choose the star on the black card.,Escoge la estrella en la carta negra.,Wähle den Stern auf der schwarzen Karte.
same-different-selection-touch-striped,same-different-selection,Choose the star on the striped card.,Escoge la estrella en la carta con rayas.,Wähle den Stern auf der gestreiften Karte.
same-different-selection-touch-1,same-different-selection,Choose the card with 1 star.,Escoge la carta con 1 estrella.,Wähle die Karte mit einem Stern.
same-different-selection-touch-2,same-different-selection,Choose the card with 2 stars.,Escoge la carta con 2 estrellas.,Wähle die Karte mit zwei Sternen.
same-different-selection-touch-3,same-different-selection,Choose the card with 3 stars.,Escoge la carta con 3 estrellas.,Wähle die Karte mit drei Sternen.
same-different-selection-touch-4,same-different-selection,Choose the card with 4 stars.,Escoge la carta con 4 estrellas.,Wähle die Karte mit vier Sternen.
same-different-selection-instruct2,same-different-selection,Now you're going to see two cards that are the same in one way. Then you will see a new card that is similar to one of those cards. Your job is to choose the card that is similar to the new card.,Ahora vas a ver dos cartas que son iguales de alguna manera. Luego vas a ver una nueva carta que se parece a una de esas cartas. Tu trabajo es elegir la carta que se parece en algo a esa nueva carta.,"Jetzt siehst du zwei Karten, die in einer Hinsicht gleich sind. Dann siehst du eine neue Karte, die einer der ersten beiden Karten ähnlich ist. Deine Aufgabe ist es, die Karte zu wählen, die der neuen Karte ähnlich ist."
same-different-selection-instruct3,same-different-selection,"Now you're going to see three cards, and you're going to choose two that are the same in some way. Then you're going to see the same cards again, and pick two cards that are the same in a different way.","Ahora vas a ver tres cartas y debes escoger dos que sean iguales de alguna manera. Luego vas a ver las mismas tres cartas, pero  vas a escoger otras dos cartas que sean iguales de alguna otra manera.","Jetzt siehst du drei Karten und wählst zwei aus, die auf irgendeine Weise gleich sind. Dann siehst du dieselben Karten noch einmal und wählst zwei Karten aus, die auf eine andere Weise gleich sind."
same-different-selection-both-circles,same-different-selection,Here are two cards. Something's the same. They both have circles.,Aquí hay dos cartas. Son iguales en algo. Ambas tienen círculos.,Hier sind zwei Karten. Sie haben etwas gemeinsam. Beide zeigen Kreise.
same-different-selection-both-squares,same-different-selection,Here are two cards. Something's the same. They both have squares.,Aquí hay dos cartas. Son iguales en algo. Ambas tienen cuadrados.,Hier sind zwei Karten. Sie haben etwas gemeinsam. Beide zeigen Quadrate.
same-different-selection-both-triangles,same-different-selection,Here are two cards. Something's the same. They both have triangles.,Aquí hay dos cartas. Son iguales en algo. Ambas tienen triángulos.,Hier sind zwei Karten. Sie haben etwas gemeinsam. Beide zeigen Dreiecke.
same-different-selection-both-red,same-different-selection,Here are two cards. Something's the same. They both have red shapes.,Aquí hay dos cartas. Son iguales en algo. Ambas tienen figuras rojas.,Hier sind zwei Karten. Sie haben etwas gemeinsam. Beide zeigen Formen.
same-different-selection-both-green,same-different-selection,Here are two cards. Something's the same. They both have green shapes.,Aquí hay dos cartas. Son iguales en algo. Ambas tienen figuras verdes.,Hier sind zwei Karten. Sie haben etwas gemeinsam. Beide zeigen grüne Formen.
same-different-selection-both-yellow,same-different-selection,Here are two cards. Something's the same. They both have yellow shapes.,Aquí hay dos cartas. Son iguales en algo. Ambas tienen figuras amarillas.,Hier sind zwei Karten. Sie haben etwas gemeinsam. Beide zeigen gelbe Formen.
same-different-selection-both-blue,same-different-selection,Here are two cards. Something's the same. They both have blue shapes.,Aquí hay dos cartas. Son iguales en algo. Ambas tienen figuras azules.,Hier sind zwei Karten. Sie haben etwas gemeinsam. Beide zeigen blaue Formen.
same-different-selection-both-small,same-different-selection,Here are two cards. Something's the same. They both have small shapes.,Aquí hay dos cartas. Son iguales en algo. Ambas tienen figuras pequeñas.,Hier sind zwei Karten. Sie haben etwas gemeinsam. Beide zeigen kleine Formen.
same-different-selection-both-medium,same-different-selection,Here are two cards. Something's the same. They both have medium-sized shapes.,Aquí hay dos cartas. Son iguales en algo. Ambas tienen figuras medianas.,Hier sind zwei Karten. Sie haben etwas gemeinsam. Beide zeigen mittelgroße Formen.
same-different-selection-both-large,same-different-selection,Here are two cards. Something's the same. They both have large shapes.,Aquí hay dos cartas. Son iguales en algo. Ambas tienen figuras grandes.,Hier sind zwei Karten. Sie haben etwas gemeinsam. Beide zeigen große Formen.
sds-prompt3,same-different-selection,Here is another card. Which of these is similar to this one?,Aquí hay otra carta. ¿Cuál de estas tiene algo que es igual a esta?,Hier ist eine weitere Karte. Welche Karte sieht dieser ähnlich? 
sds-3match-prompt2,same-different-selection,Here is the same set of cards again. Choose two cards that are the same in a different way.,Aquí están otra vez las mismas cartas. Ahora debe escoger dos cartas que sean pareja porque son iguales en algo diferente.,"Hier siehst du die gleichen Karten nochmal. Wähle zwei Bilder aus, die auf unterschiedliche Art und Weise gleich sind."
sds-2match-prompt1,same-different-selection,Here is a new set of cards. Choose two cards that are the same in some way.,Aquí hay un nuevo grupo de cartas. Escoge dos cartas que sean iguales en algún aspecto. ,"Hier sind neue Karten. Wähle zwei Karten aus, die in irgendeiner Weise gleich sind."
sds-2match-prompt2,same-different-selection,Choose two cards that are the same in a different way.,Escoge dos cartas que sean pareja porque son iguales en algo diferente. ,"Wähle zwei Karten, die auf unterschiedliche Weise gleich sind."
sds-3unique-prompt1,same-different-selection,Choose three cards that are the same in only one way.,Escoge tres cartas que sean iguales en un solo aspecto. ,"Wähle drei Karten aus, die in irgendeiner Weise gleich sind."
sds-3unique-prompt2,same-different-selection,Choose another three cards that are the same in only one way.,Escoge otras tres cartas que sean iguales en un solo aspecto.,"Wähle drei weitere Karten aus, die auf unterschiedliche Art und Weise gleich sind."
memory-game-display,memory-game,Watch the squares light up.,Watch the squares light up.,Watch the squares light up.
memory-game-input,memory-game,Touch the squares in the same order.,Touch the squares in the same order.,Touch the squares in the same order.
memory-game-instruct1,memory-game,This is the memory game. Here's how you play it.,This is the memory game. Here's how you play it.,This is the memory game. Here's how you play it.
memory-game-instruct2,memory-game,You will see squares light up.,You will see squares light up.,You will see squares light up.
memory-game-instruct3,memory-game,You're going to touch the squares in the same order.,You're going to touch the squares in the same order.,You're going to touch the squares in the same order.
memory-game-instruct4,memory-game,Watch carefully! Try to remember the order.,Watch carefully! Try to remember the order.,Watch carefully! Try to remember the order.
memory-game-forward-prompt,memory-game,Choose the squares in the same order.,Choose the squares in the same order.,Choose the squares in the same order.
memory-game-forward-try-again,memory-game,That's not right. Try again. Choose the squares in the same order.,La respuesta no es correcta.  Inténtalo de nuevo. Escoge los cuadrados en el mismo orden.,Das ist nicht richtig. Versuch es noch einmal. Wähle die Quadrate in der gleichen Reihenfolge.
memory-game-instruct5,memory-game,This time the game won't tell you if you're right or wrong. Let’s start playing the memory game!,Esta vez el juego no te dirá si la respuesta es correcta o no. ¡Empecemos a jugar al juego de memoria!,"Dieses Mal wird dir das Spiel nicht sagen, ob du richtig oder falsch liegst. Los geht's mit dem Memory-Spiel!"
memory-game-instruct6,memory-game,Now let's play the memory game in reverse!,Now let's play the memory game in reverse!,Now let's play the memory game in reverse!
memory-game-instruct7,memory-game,Let’s start playing the memory game!,Let’s start playing the memory game!,Let’s start playing the memory game!
memory-game-backward-prompt,memory-game,Choose the squares in the backward order.,Choose the squares in the backward order.,Choose the squares in the backward order.
memory-game-backward-try-again,memory-game,That's not right. Try again. Choose the squares in the backward order.,La respuesta no es correcta.  Inténtalo de nuevo. Escoge los cuadrados en orden inverso.,Das ist nicht richtig. Versuch es noch einmal. Wähle die Quadrate in der umgekehrten Reihenfolge.
heart-instruct1,hearts-and-flowers,This is the heart game. Here's how you play it.,This is the heart game. Here's how you play it.,This is the heart game. Here's how you play it.
heart-instruct2,hearts-and-flowers,"When you see a heart, press the button on the same side.","Cuando veas un corazón, presiona el botón del mismo lado.","Wenn du ein Herz siehst, drücke den Knopf auf der gleichen Seite."
hearts-and-flowers-try-again,hearts-and-flowers,That's not right. Try again.,That's not right. Try again.,That's not right. Try again.
heart-practice-feedback1,hearts-and-flowers,The heart is on the right side. Press the right button.,The heart is on the right side. Press the right button.,The heart is on the right side. Press the right button.
hearts-and-flowers-practice-time,hearts-and-flowers,Time to practice!,Time to practice!,Time to practice!
heart-practice-feedback2,hearts-and-flowers,"Remember! When you see a HEART, press the button on the SAME side.","Remember! When you see a HEART, press the button on the SAME side.","Remember! When you see a HEART, press the button on the SAME side."
hearts-and-flowers-instruct1,hearts-and-flowers,This time the game will go faster. It won't tell you if you are right or wrong. Try to keep up!,Esta vez el juego irá más rápido. No te dirá si la respuesta es correcta o no. ¡Trata de seguir el ritmo!,"Jetzt spielen wir das Spiel schneller. Es wird dir nicht sagen, ob du richtig oder falsch liegst. Versuch hinterherzukommen!"
hearts-and-flowers-instruct2,hearts-and-flowers,"Try to answer as fast as you can without making mistakes. If you make a mistake, just keep going!","Intenta responder lo más rápido que puedas sin cometer errores. Si cometes un error, ¡sigue adelante!","Versuche, so schnell wie möglich zu antworten, ohne Fehler zu machen. Wenn du einen Fehler machst, mach einfach weiter!"
hearts-and-flowers-play-time,hearts-and-flowers,Time to play!,Time to play!,Time to play!
flower-instruct1,hearts-and-flowers,This is the flower game. Here's how you play it.,Este es el juego de las flores. Las reglas son las siguientes.,Das ist das Blumenspiel. Ich erkläre dir jetzt wie das Blumenspiel funktioniert.
flower-instruct2,hearts-and-flowers,"When you see a flower, press the button on the opposite side.","When you see a flower, press the button on the opposite side.","When you see a flower, press the button on the opposite side."
flower-practice-feedback1,hearts-and-flowers,The flower is on the left side. Press the right button.,The flower is on the left side. Press the right button.,The flower is on the left side. Press the right button.
flower-practice-feedback2,hearts-and-flowers,"When you see a FLOWER, press the button on the OPPOSITE side.","When you see a FLOWER, press the button on the OPPOSITE side.","When you see a FLOWER, press the button on the OPPOSITE side."
hearts-and-flowers-instruct3,hearts-and-flowers,"Now, we're going to play a game with hearts and flowers.","Now, we're going to play a game with hearts and flowers.","Now, we're going to play a game with hearts and flowers."
hearts-and-flowers-encourage1,hearts-and-flowers,Try to keep up!,Try to keep up!,Try to keep up!
hearts-and-flowers-encourage2,hearts-and-flowers,"If you make a mistake, just keep going!","If you make a mistake, just keep going!","If you make a mistake, just keep going!"
hearts-and-flowers-end,hearts-and-flowers,Great job! You completed the game!,"¡Bien hecho, has terminado el juego!",Gut gemacht! Dieses Spiel ist jetzt zu Ende.
vocab-item-001,vocab,the acorn,la bellota,die eichel
vocab-item-002,vocab,the aloe,el áloe,die aloe
vocab-item-003,vocab,the antenna,la antena,die antenne
vocab-item-004,vocab,the artichoke,la alcachofa,die artischocke
vocab-item-005,vocab,the bamboo,el bambú,der bambus
vocab-item-006,vocab,the barrel,el barril,das fass
vocab-item-007,vocab,the blender,la licuadora,der mixer
vocab-item-008,vocab,the blower,el soplador,das gebläse
vocab-item-009,vocab,the bouquet,el ramo,der blumenstrauß
vocab-item-010,vocab,the buffet,el bufé,das buffet
vocab-item-011,vocab,the bulldozer,la excavadora,die planierraupe
vocab-item-012,vocab,the cake,el pastel,der kuchen
vocab-item-013,vocab,the caramel,el caramelo,das karamell
vocab-item-014,vocab,the carousel,el carrusel,das karussell
vocab-item-015,vocab,the carrot,la zanahoria,die karotte
vocab-item-016,vocab,the cassette,el casete,die kassette
vocab-item-017,vocab,the cheese,el queso,der käse
vocab-item-018,vocab,the cloak,la capucha,der mantel
vocab-item-019,vocab,the clothespin,la pinza para la ropa,die wäscheklammer
vocab-item-020,vocab,the coaster,el portavasos,der untersetzer
vocab-item-021,vocab,the cork,el corcho,der korken
vocab-item-022,vocab,the cornbread,el pan de maíz,das maisbrot
vocab-item-023,vocab,the corset,el corsé,das korsett
vocab-item-024,vocab,the dumpling,el dumpling,der Teigtaschen
vocab-item-025,vocab,the elbow,el codo,der ellbogen
vocab-item-026,vocab,the fan,el ventilador,der ventilator
vocab-item-027,vocab,the foam,la espuma,der schaumstoff
vocab-item-028,vocab,the footbath,la lavapiés,das fußbad
vocab-item-029,vocab,the fruitcake,el pastel de frutas,der obstkuchen
vocab-item-030,vocab,the gutter,la canaleta,die dachrinne
vocab-item-031,vocab,the hamster,el hámster,der hamster
vocab-item-032,vocab,the hedgehog,el erizo,der igel
vocab-item-033,vocab,the hoe,la azadilla,die hacke
vocab-item-034,vocab,the hopscotch,la golosa,Himmel und Hölle
vocab-item-035,vocab,the kimono,el kimono,der kimono
vocab-item-036,vocab,the latch,el cerrojo,der riegel
vocab-item-037,vocab,the locker,el casillero,das schließfach
vocab-item-038,vocab,the lollipop,la chupeta,der lollipop
vocab-item-039,vocab,the map,el mapa,die karte
vocab-item-040,vocab,the marshmallow,el malvavisco,der marshmallow
vocab-item-041,vocab,the net,la malla,das netz
vocab-item-042,vocab,the oil,el aceite,das öl
vocab-item-043,vocab,the omelet,la tortilla,das omelett
vocab-item-044,vocab,the pie,la tarta,der kuchen
vocab-item-045,vocab,the pistachio,el pistacho,die pistazien
vocab-item-046,vocab,the pitcher,la jarra,der krug
vocab-item-047,vocab,the potato,la papa,die kartoffel
vocab-item-048,vocab,the prism,el prisma,das prisma
vocab-item-049,vocab,the puddle,el charco,die pfütze
vocab-item-050,vocab,the pump,la bomba de agua,die pumpe
vocab-item-051,vocab,the rice,el arroz,der reis
vocab-item-052,vocab,the saddle,la silla de montar,der sattel
vocab-item-053,vocab,the sandbag,el saco de arena,der sandsack
vocab-item-054,vocab,the scaffolding,el andamio,das gerüst
vocab-item-055,vocab,the scoop,el cucharón,die schaufel
vocab-item-056,vocab,the seagull,la gaviota,die möwe
vocab-item-057,vocab,the ship,el barco,das schiff
vocab-item-058,vocab,the shower,la ducha,die dusche
vocab-item-059,vocab,the silverware,los cubiertos,der tafelsilber
vocab-item-060,vocab,the sink,el lavabo,das waschbecken
vocab-item-061,vocab,the ski,el esquí,der ski
vocab-item-062,vocab,the sloth,el oso perozoso,das faultier
vocab-item-063,vocab,the snail,el caracol,die schnecke
vocab-item-064,vocab,the sorbet,el sorbete,das sorbet
vocab-item-065,vocab,the spatula,la espátula,der Pfannenwender
vocab-item-066,vocab,the sprinkler,el aspersor,der sprinkler
vocab-item-067,vocab,the squash,la calabaza,der kürbis
vocab-item-068,vocab,the squirrel,la ardilla,das eichhörnchen
vocab-item-069,vocab,the stew,el guiso,der Eintopf
vocab-item-070,vocab,the rubber band,la banda elástica,das Gummiband
vocab-item-071,vocab,the stump,el tocón,der baumstumpf
vocab-item-072,vocab,the sunflower,el girasol,die sonnenblume
vocab-item-073,vocab,the swordfish,el pez espada,der schwertfisch
vocab-item-074,vocab,the tapestry,el tapiz,der wandteppich
vocab-item-075,vocab,the teabag,la bolsa de té,der teebeutel
vocab-item-076,vocab,the telescope,el telescopio,der teleskop
vocab-item-077,vocab,the thermos,el termo,die thermoskanne
vocab-item-078,vocab,the treasure,el tesoro,der schatz
vocab-item-079,vocab,the trumpet,la trompeta,die trompete
vocab-item-080,vocab,the tulip,el tulipán,die tulpe
vocab-item-081,vocab,the turbine,la turbina,die turbine
vocab-item-082,vocab,the turkey,el pavo,der truthahn
vocab-item-083,vocab,the turtle,la tortuga,die schildkröte
vocab-item-084,vocab,the typewriter,la máquina de escribir,die schreibmaschine
vocab-item-085,vocab,the watermelon,la sandía,die wassermelone
vocab-item-086,vocab,the waterwheel,la rueda hidráulica,das wasserrad
vocab-item-087,vocab,the ant,la hormiga,die ameise
vocab-item-088,vocab,the ball,la pelota,der kugel
